,html_url,legislative_term,reference,title,interpellation_type,published_at,body,inquiring_parties_wikidata,inquiring_people_wikidata,answering_ministries_wikidata
1131,https://kleineanfragen.de/baden-wuerttemberg/15/4275-auswirkungen-der-fortschreibung-der-plausibilitaetspruefung-der-bauflaechenbedarfsnachweise-im-rahmen-des,15,4275,Auswirkungen der Fortschreibung der Plausibilitätsprüfung der Bauflächenbedarfsnachweise im Rahmen des Genehmigungsverfahrens nach §§ 6 und 10 Absatz 2 Baugesetzbuch (BauGB) in den Gemeinden des Alb-Donau-Kreises (Wahlkreis 65 Ehingen),minor,2013-11-04,Baden-Württemberg,CDU,Karl Traub,Ministerium für Verkehr und Infrastruktur
1132,https://kleineanfragen.de/baden-wuerttemberg/15/4274-auswirkungen-der-fortschreibung-der-plausibilitaetspruefung-der-bauflaechenbedarfsnachweise-im-rahmen-des,15,4274,Auswirkungen der Fortschreibung der Plausibilitätsprüfung der Bauflächenbedarfsnachweise im Rahmen des Genehmigungsverfahrens nach §§ 6 und 10 Absatz 2 Baugesetzbuch (BauGB) im Land-kreis Emmendingen,minor,2013-11-04,Baden-Württemberg,CDU,Marcel Schwehr,Ministerium für Verkehr und Infrastruktur
1133,https://kleineanfragen.de/baden-wuerttemberg/15/4265-gebaeudeschaeden-durch-erdhebungen-in-boeblingen,15,4265,Gebäudeschäden durch Erdhebungen in Böblingen,minor,2013-10-31,Baden-Württemberg,CDU,Paul Nemeth,"Ministerium für Umwelt, Klima und Energiewirtschaft"
1134,https://kleineanfragen.de/baden-wuerttemberg/15/4264-verfassungsschutzbericht-2012-verfassungsfeinde-im-landkreis-waldshut-und-den-staedten-rheinfelden-und-schwoerstadt,15,4264,Verfassungsschutzbericht 2012 – Verfassungsfeinde im Landkreis Waldshut und den Städten Rheinfelden und Schwörstadt,minor,2013-10-31,Baden-Württemberg,CDU,Felix Schreiner,"Ministerium für Inneres, Digitalisierung und Migration"
1135,https://kleineanfragen.de/baden-wuerttemberg/15/4263-auswirkungen-der-fortschreibung-der-plausibilitaetspruefung-der-bauflaechenbedarfsnachweise-im-rahmen-des,15,4263,Auswirkungen der Fortschreibung der Plausibilitätsprüfung der Bauflächenbedarfsnachweise im Rahmen des Genehmigungsverfahrens nach §§ 6 und 10 Absatz 2 Baugesetzbuch (BauGB) im Wahlkreis Schorndorf,minor,2013-10-31,Baden-Württemberg,CDU,Claus Paal,Ministerium für Verkehr und Infrastruktur
1136,https://kleineanfragen.de/baden-wuerttemberg/15/4262-auswirkungen-der-fortschreibung-der-plausibilitaetspruefung-der-bauflaechenbedarfsnachweise-im-rahmen-des,15,4262,Auswirkungen der Fortschreibung der Plausibilitätsprüfung der Bauflächenbedarfsnachweise im Rahmen des Genehmigungsverfahrens nach §§ 6 und 10 Absatz 2 Baugesetzbuch (BauGB) in den Gemeinden des Bodenseekreises,minor,2013-10-31,Baden-Württemberg,CDU,Ulrich Müller,Ministerium für Verkehr und Infrastruktur
1137,https://kleineanfragen.de/baden-wuerttemberg/15/4259-auswirkungen-der-fortschreibung-der-plausibilitaetspruefung-der-bauflaechenbedarfsnachweise-im-rahmen-des,15,4259,Auswirkungen der Fortschreibung der Plausibilitätsprüfung der Bauflächenbedarfsnachweise im Rahmen des Genehmigungsverfahrens nach §§ 6 und 10 Absatz 2 Baugesetzbuch (BauGB) in den Landkreisen Lörrach und Waldshut,minor,2013-10-29,Baden-Württemberg,CDU,Felix Schreiner;Ulrich Lusche,Ministerium für Verkehr und Infrastruktur
1138,https://kleineanfragen.de/baden-wuerttemberg/15/4258-service-auf-der-stadtbahnlinie-bietigheim-bissingen-woerth,15,4258,Service auf der Stadtbahnlinie Bietigheim-Bissingen–Wörth,minor,2013-10-29,Baden-Württemberg,FDP/DVP,Hans-Ulrich Rülke,Ministerium für Verkehr und Infrastruktur
1139,https://kleineanfragen.de/baden-wuerttemberg/15/4257-auswirkungen-der-fortschreibung-der-plausibilitaetspruefung-der-bauflaechenbedarfsnachweise-im-rahmen-des,15,4257,Auswirkungen der Fortschreibung der Plausibilitätsprüfung der Bauflächenbedarfsnachweise im Rahmen des Genehmigungsverfahrens nach §§ 6 und 10 Absatz 2 Baugesetzbuch (BauGB) im Stadtkreis Baden-Baden und im südlichen Landkreis Rastatt,minor,2013-10-28,Baden-Württemberg,CDU,Tobias Wald,Ministerium für Verkehr und Infrastruktur
1140,https://kleineanfragen.de/baden-wuerttemberg/15/4256-auswirkungen-der-fortschreibung-der-plausibilitaetspruefung-der-bauflaechenbedarfsnachweise-im-rahmen-des,15,4256,Auswirkungen der Fortschreibung der Plausibilitätsprüfung der Bauflächenbedarfsnachweise im Rahmen des Genehmigungsverfahrens nach §§ 6 und 10 Absatz 2 Baugesetzbuch (BauGB) im Landkreis Rastatt,minor,2013-10-28,Baden-Württemberg,CDU,Karl-Wolfgang Jägel,Ministerium für Verkehr und Infrastruktur
1141,https://kleineanfragen.de/baden-wuerttemberg/15/4255-hilfsfristen-im-landkreis-esslingen,15,4255,Hilfsfristen im Landkreis Esslingen,minor,2013-10-28,Baden-Württemberg,CDU,Thaddäus Kunzmann,"Ministerium für Inneres, Digitalisierung und Migration"
1142,https://kleineanfragen.de/baden-wuerttemberg/15/4254-auswirkungen-der-fortschreibung-der-plausibilitaetspruefung-der-bauflaechenbedarfsnachweise-im-rahmen-des,15,4254,Auswirkungen der Fortschreibung der Plausibilitätsprüfung der Bauflächenbedarfsnachweise im Rahmen des Genehmigungsverfahrens nach §§ 6 und 10 Absatz 2 Baugesetzbuch (BauGB) im Landkreis Esslingen,minor,2013-10-28,Baden-Württemberg,CDU,Thaddäus Kunzmann,Ministerium für Verkehr und Infrastruktur
1143,https://kleineanfragen.de/baden-wuerttemberg/15/4249-auswirkungen-der-fortschreibung-der-plausibilitaetspruefung-der-bauflaechenbedarfsnachweise-im-rahmen-des,15,4249,Auswirkungen der Fortschreibung der Plausibilitätsprüfung der Bauflächenbedarfsnachweise im Rahmen des Genehmigungsverfahrens nach §§ 6 und 10 Absatz 2 Baugesetzbuch (BauGB) im Landkreis Schwäbisch Hall,minor,2013-10-25,Baden-Württemberg,CDU,Helmut Walter Rüeck,Ministerium für Verkehr und Infrastruktur
1144,https://kleineanfragen.de/baden-wuerttemberg/15/4246-strukturfoerderung-im-schwarzwald-baar-kreis,15,4246,Strukturförderung im Schwarzwald-Baar-Kreis,minor,2013-10-25,Baden-Württemberg,CDU,Karl Rombach,Ministerium für Ländlichen Raum und Verbraucherschutz
1145,https://kleineanfragen.de/baden-wuerttemberg/15/4242-auswirkungen-der-fortschreibung-der-plausibilitaetspruefung-der-bauflaechenbedarfsnachweise-im-rahmen-des,15,4242,Auswirkungen der Fortschreibung der Plausibilitätsprüfung der Bauflächenbedarfsnachweise im Rahmen des Genehmigungsverfahrens nach §§ 6 und 10 Absatz 2 Baugesetzbuch (BauGB) in den Städten und Gemeinden des Wahlkreises Neckarsulm,minor,2013-10-25,Baden-Württemberg,CDU,Bernhard Lasotta,Ministerium für Verkehr und Infrastruktur
1146,https://kleineanfragen.de/baden-wuerttemberg/15/4241-umsetzung-des-massnahmenkatalogs-2013-zur-barrierefreien-gestaltung-des-programmangebots,15,4241,Umsetzung des Maßnahmenkatalogs 2013 zur barrierefreien Gestaltung des Programmangebots,minor,2013-10-25,Baden-Württemberg,CDU,Werner Raab,Staatsministerium
1147,https://kleineanfragen.de/baden-wuerttemberg/15/4238-windkraft-im-landkreis-schwaebisch-hall,15,4238,Windkraft im Landkreis Schwäbisch Hall,minor,2013-10-24,Baden-Württemberg,CDU,Helmut Walter Rüeck,"Ministerium für Umwelt, Klima und Energiewirtschaft"
1148,https://kleineanfragen.de/baden-wuerttemberg/15/4237-landesstrassen-und-radwege-im-rems-murr-kreis,15,4237,Landesstraßen und Radwege im Rems-Murr-Kreis,minor,2013-10-24,Baden-Württemberg,SPD,Gernot Gruber,Ministerium für Verkehr und Infrastruktur
1149,https://kleineanfragen.de/baden-wuerttemberg/15/4236-brueckensanierung-im-landkreis-esslingen,15,4236,Brückensanierung im Landkreis Esslingen,minor,2013-10-24,Baden-Württemberg,CDU,Andreas Deuschle,Ministerium für Finanzen und Wirtschaft;Ministerium für Verkehr und Infrastruktur
1150,https://kleineanfragen.de/baden-wuerttemberg/15/4198-auswirkungen-der-fortschreibung-der-plausibilitaetspruefung-der-bauflaechenbedarfsnachweise-im-rahmen-des,15,4198,Auswirkungen der Fortschreibung der Plausibilitätsprüfung der Bauflächenbedarfsnachweise im Rahmen des Genehmigungsverfahrens nach §§ 6 und 10 Absatz 2 Baugesetzbuch im Landkreis Heidenheim,minor,2013-10-24,Baden-Württemberg,CDU,Bernd Hitzler,Ministerium für Verkehr und Infrastruktur
1151,https://kleineanfragen.de/baden-wuerttemberg/15/4073-campingtourismus-in-baden-wuerttemberg,15,4073,Campingtourismus in Baden-Württemberg,minor,2013-10-24,Baden-Württemberg,SPD,Hans-Peter Storz,Ministerium für Verkehr und Infrastruktur;Ministerium für Ländlichen Raum und Verbraucherschutz
1152,https://kleineanfragen.de/baden-wuerttemberg/15/4197-fluechtlings-und-asylpolitik,15,4197,Flüchtlings- und Asylpolitik,major,2013-10-23,Baden-Württemberg,CDU,,Landesregierung
1153,https://kleineanfragen.de/baden-wuerttemberg/15/4196-ausbau-der-windkraft,15,4196,Ausbau der Windkraft,minor,2013-10-23,Baden-Württemberg,CDU,Georg Wacker,"Ministerium für Umwelt, Klima und Energiewirtschaft"
1154,https://kleineanfragen.de/baden-wuerttemberg/15/4193-umsetzung-von-platzverweisen-fuer-gewalttaetige-partner,15,4193,Umsetzung von Platzverweisen für gewalttätige Partner,minor,2013-10-22,Baden-Württemberg,FDP/DVP,Ulrich Goll,"Ministerium für Inneres, Digitalisierung und Migration"
1155,https://kleineanfragen.de/baden-wuerttemberg/15/4121-kennzeichnungsmethoden-bei-rindern-sowie-behoerdliche-anordnungen-gegenueber-dem-biolandbetrieb-maier-uria-e-v,15,4121,"Kennzeichnungsmethoden bei Rindern sowie behördliche Anordnungen gegenüber dem Biolandbetrieb Maier (URIA e. V.), Balingen",minor,2013-10-21,Baden-Württemberg,Die Grünen,Reinhold Pix,Ministerium für Ländlichen Raum und Verbraucherschutz
1156,https://kleineanfragen.de/baden-wuerttemberg/15/4172-sanierung-des-fahrbahnbelags-von-landesstrassen-im-enzkreis,15,4172,Sanierung des Fahrbahnbelags von Landesstraßen im Enzkreis,minor,2013-10-18,Baden-Württemberg,FDP/DVP,Hans-Ulrich Rülke,Ministerium für Verkehr und Infrastruktur
1157,https://kleineanfragen.de/baden-wuerttemberg/15/4147-verlegung-und-schliessung-kleiner-klassen-an-beruflichen-schulen-in-der-technologieregion-karlsruhe-und-die,15,4147,Verlegung und Schließung kleiner Klassen an beruflichen Schulen in der Technologieregion Karlsruhe und die Auswirkungen auf die Wirtschaft,minor,2013-10-15,Baden-Württemberg,CDU,Katrin Schütz,"Ministerium für Finanzen und Wirtschaft;Ministerium für Kultus, Jugend und Sport"
1158,https://kleineanfragen.de/baden-wuerttemberg/15/4149-versetzung-der-ministerialdirektorin-im-kultusministerium-in-den-einstweiligen-ruhestand,15,4149,Versetzung der Ministerialdirektorin im Kultusministerium in den einstweiligen Ruhestand,minor,2013-10-14,Baden-Württemberg,FDP/DVP,Hans-Ulrich Rülke,"Ministerium für Kultus, Jugend und Sport"
1159,https://kleineanfragen.de/baden-wuerttemberg/15/4146-werbung-des-oberbuergermeisters-der-landeshauptstadt-stuttgart-fuer-einen-kommerziellen-finanzdienstleister,15,4146,Werbung des Oberbürgermeisters der Landeshauptstadt Stuttgart für einen kommerziellen Finanzdienstleister,minor,2013-10-11,Baden-Württemberg,CDU,Reinhard Löffler,"Ministerium für Inneres, Digitalisierung und Migration"
1160,https://kleineanfragen.de/baden-wuerttemberg/15/4144-entsorgung-der-anfallenden-abfaelle-im-zuge-des-rueckbaus-von-kern-kraftwerken-hier-insbesondere-des-kernkraftwerks,15,4144,"Entsorgung der anfallenden Abfälle im Zuge des Rückbaus von Kern-kraftwerken, hier insbesondere des Kernkraftwerks Obrigheim",minor,2013-10-10,Baden-Württemberg,CDU,Peter Hauk,"Ministerium für Umwelt, Klima und Energiewirtschaft"
1161,https://kleineanfragen.de/baden-wuerttemberg/15/4143-unbesetzte-lehrerdeputate-an-der-waldschule-pforzheim-buechenbronn,15,4143,Unbesetzte Lehrerdeputate an der Waldschule Pforzheim-Büchenbronn,minor,2013-10-10,Baden-Württemberg,CDU,Marianne Engeser,"Ministerium für Kultus, Jugend und Sport"
1162,https://kleineanfragen.de/baden-wuerttemberg/15/4134-rechtsextremismus-in-der-region-baden-baden-rastatt-und-umland,15,4134,Rechtsextremismus in der Region Baden-Baden/Rastatt und Umland,minor,2013-10-10,Baden-Württemberg,SPD;Die Grünen,Ernst Kopp;Beate Böhlen,"Ministerium für Inneres, Digitalisierung und Migration"
1163,https://kleineanfragen.de/baden-wuerttemberg/15/4131-studentisches-dienstleistungszentrum-an-der-universitaet-ulm,15,4131,Studentisches Dienstleistungszentrum an der Universität Ulm,minor,2013-10-09,Baden-Württemberg,SPD,Martin Rivoir,"Ministerium für Wissenschaft, Forschung und Kunst"
1164,https://kleineanfragen.de/baden-wuerttemberg/15/4119-museumsprojekt-vogtsbauernhof-freilichtmuseen-in-baden-wuerttemberg,15,4119,Museumsprojekt „Vogtsbauernhof“ – Freilichtmuseen in Baden-Württemberg,minor,2013-10-07,Baden-Württemberg,FDP/DVP,Dr. Friedrich Bullinger,"Ministerium für Wissenschaft, Forschung und Kunst"
1165,https://kleineanfragen.de/baden-wuerttemberg/15/4112-polizeireform-im-kreis-rottweil-neue-entwicklungen,15,4112,Polizeireform im Kreis Rottweil: neue Entwicklungen,minor,2013-10-02,Baden-Württemberg,CDU,Stefan Teufel,"Ministerium für Inneres, Digitalisierung und Migration"
1166,https://kleineanfragen.de/baden-wuerttemberg/15/4111-strassenbaumassnahmen-im-landkreis-schwaebisch-hall,15,4111,Straßenbaumaßnahmen im Landkreis Schwäbisch Hall,minor,2013-10-02,Baden-Württemberg,CDU,Helmut Walter Rüeck,Ministerium für Verkehr und Infrastruktur
1167,https://kleineanfragen.de/baden-wuerttemberg/15/4107-klebekennzeichen-fuer-kraftfahrzeuge,15,4107,Klebekennzeichen für Kraftfahrzeuge,minor,2013-10-02,Baden-Württemberg,FDP/DVP,Jochen Haußmann,Ministerium für Verkehr und Infrastruktur
1168,https://kleineanfragen.de/baden-wuerttemberg/15/4104-foerderung-soziokultureller-einrichtungen,15,4104,Förderung soziokultureller Einrichtungen,minor,2013-09-30,Baden-Württemberg,CDU,Thaddäus Kunzmann,"Ministerium für Wissenschaft, Forschung und Kunst"
1169,https://kleineanfragen.de/baden-wuerttemberg/15/4103-hoergeschaedigte-und-gebaerdensprachdolmetscher,15,4103,Hörgeschädigte und Gebärdensprachdolmetscher,minor,2013-09-30,Baden-Württemberg,CDU,Dietrich Birk,"Ministerium für Kultus, Jugend und Sport;Ministerium für Arbeit und Sozialordnung, Familie, Frauen und Senioren"
1170,https://kleineanfragen.de/baden-wuerttemberg/15/4102-bundesstrasse-b-31-west-projektgruppe-suedoestlicher-kaiserstuhl,15,4102,Bundesstraße (B) 31 West – Projektgruppe „südöstlicher Kaiserstuhl“,minor,2013-09-30,Baden-Württemberg,CDU,Patrick Rapp,Ministerium für Verkehr und Infrastruktur
1171,https://kleineanfragen.de/baden-wuerttemberg/15/4082-schulsozialarbeit-im-landkreis-esslingen,15,4082,Schulsozialarbeit im Landkreis Esslingen,minor,2013-09-25,Baden-Württemberg,Die Grünen,Andrea Lindlohr,"Ministerium für Arbeit und Sozialordnung, Familie, Frauen und Senioren"
1172,https://kleineanfragen.de/baden-wuerttemberg/15/4072-schulsozialarbeit-im-landkreis-konstanz,15,4072,Schulsozialarbeit im Landkreis Konstanz,minor,2013-09-23,Baden-Württemberg,SPD,Hans-Peter Storz,"Ministerium für Arbeit und Sozialordnung, Familie, Frauen und Senioren"
1173,https://kleineanfragen.de/baden-wuerttemberg/15/4062-entwicklung-der-zusatzangebote-und-der-kostenfreien-arbeitsgemeinschaften-an-den-schulen-im-landkreis-esslingen,15,4062,Entwicklung der Zusatzangebote und der kostenfreien Arbeitsgemeinschaften an den Schulen im Landkreis Esslingen,minor,2013-09-19,Baden-Württemberg,CDU,Andreas Deuschle,"Ministerium für Finanzen und Wirtschaft;Ministerium für Kultus, Jugend und Sport"
1174,https://kleineanfragen.de/baden-wuerttemberg/15/4061-entwicklung-der-schuelerzahlen-an-den-haupt-und-werkrealschulen-realschulen-und-gymnasien-und-das,15,4061,"Entwicklung der Schülerzahlen an den Haupt- und Werkrealschulen, Realschulen und Gymnasien und das Übertrittsverhalten der Schülerinnen und Schüler im Landkreis Esslingen",minor,2013-09-19,Baden-Württemberg,CDU,Andreas Deuschle,"Ministerium für Kultus, Jugend und Sport"
1175,https://kleineanfragen.de/baden-wuerttemberg/15/4060-radwege-im-landkreis-rhein-neckar-und-in-den-stadtkreisen-heidelberg-und-mannheim,15,4060,Radwege im Landkreis Rhein-Neckar und in den Stadtkreisen Heidelberg und Mannheim,minor,2013-09-18,Baden-Württemberg,SPD,Rosa Grünstein,Ministerium für Verkehr und Infrastruktur
1176,https://kleineanfragen.de/baden-wuerttemberg/15/4058-leseklassen-im-landkreis-esslingen,15,4058,Leseklassen im Landkreis Esslingen,minor,2013-09-18,Baden-Württemberg,CDU,Andreas Deuschle,"Ministerium für Finanzen und Wirtschaft;Ministerium für Kultus, Jugend und Sport"
1177,https://kleineanfragen.de/baden-wuerttemberg/15/4057-energie-aus-wildpflanzen,15,4057,Energie aus Wildpflanzen,minor,2013-09-18,Baden-Württemberg,CDU,Paul Locherer,"Ministerium für Umwelt, Klima und Energiewirtschaft;Ministerium für Ländlichen Raum und Verbraucherschutz"
1178,https://kleineanfragen.de/baden-wuerttemberg/15/4031-ist-eine-grundlegende-neuregelung-des-landesjagdgesetzes-noetig,15,4031,Ist eine grundlegende Neuregelung des Landesjagdgesetzes nötig?,major,2013-09-17,Baden-Württemberg,CDU,,Landesregierung
1179,https://kleineanfragen.de/baden-wuerttemberg/15/4032-musikhochschulen-in-baden-wuerttemberg,15,4032,Musikhochschulen in Baden-Württemberg,minor,2013-09-16,Baden-Württemberg,SPD,Helen Heberer,"Ministerium für Wissenschaft, Forschung und Kunst"
1180,https://kleineanfragen.de/baden-wuerttemberg/15/4030-unterrichtspraktische-unterstuetzung-der-gemeinschaftsschulen,15,4030,Unterrichtspraktische Unterstützung der Gemeinschaftsschulen,minor,2013-09-13,Baden-Württemberg,Die Grünen,Sandra Boser,"Ministerium für Kultus, Jugend und Sport"
1181,https://kleineanfragen.de/baden-wuerttemberg/15/4013-pflegemassnahmen-in-naturschutzgebieten-im-wahlkreis-33,15,4013,Pflegemaßnahmen in Naturschutzgebieten im Wahlkreis 33,minor,2013-09-11,Baden-Württemberg,CDU,Tobias Wald,Ministerium für Ländlichen Raum und Verbraucherschutz
1182,https://kleineanfragen.de/baden-wuerttemberg/15/4020-sommerschulen-in-karlsruhe,15,4020,Sommerschulen in Karlsruhe,minor,2013-09-10,Baden-Württemberg,CDU,Katrin Schütz,"Ministerium für Kultus, Jugend und Sport"
1183,https://kleineanfragen.de/baden-wuerttemberg/15/4009-bundesverkehrswegeplan-massnahmen-an-bundesstrassen-im-re-gierungsbezirk-tuebingen,15,4009,Bundesverkehrswegeplan – Maßnahmen an Bundesstraßen im Re-gierungsbezirk Tübingen,minor,2013-09-06,Baden-Württemberg,CDU,Karl Traub;Monika Stolz;Ulrich Müller;Paul Locherer;Rudolf Köberle;Klaus Burger;Peter Schneider,Ministerium für Verkehr und Infrastruktur
1184,https://kleineanfragen.de/baden-wuerttemberg/15/4005-kreislaufwirtschaftsgesetz-und-seine-auswirkungen-auf-schrotthaendler,15,4005,Kreislaufwirtschaftsgesetz und seine Auswirkungen auf Schrotthändler,minor,2013-09-04,Baden-Württemberg,FDP/DVP,Andreas Glück,"Ministerium für Umwelt, Klima und Energiewirtschaft"
1185,https://kleineanfragen.de/baden-wuerttemberg/15/4002-zugausfaelle-auf-der-bahnstrecke-stuttgart-pforzheim-karlsruhe,15,4002,Zugausfälle auf der Bahnstrecke Stuttgart – Pforzheim – Karlsruhe,minor,2013-09-04,Baden-Württemberg,FDP/DVP,Hans-Ulrich Rülke,Ministerium für Verkehr und Infrastruktur
1186,https://kleineanfragen.de/baden-wuerttemberg/15/4001-naturschutzgebiet-ulm-lichternsee,15,4001,Naturschutzgebiet Ulm-Lichternsee,minor,2013-09-04,Baden-Württemberg,SPD,Martin Rivoir,Ministerium für Ländlichen Raum und Verbraucherschutz
1187,https://kleineanfragen.de/baden-wuerttemberg/15/4000-lehrerversorgung-an-den-beruflichen-schulen-im-stadt-und-landkreis-heilbronn,15,4000,Lehrerversorgung an den beruflichen Schulen im Stadt- und Landkreis Heilbronn,minor,2013-09-04,Baden-Württemberg,CDU,Bernhard Lasotta;Friedlinde Gurr-Hirsch;Alexander Throm,"Ministerium für Kultus, Jugend und Sport"
1188,https://kleineanfragen.de/baden-wuerttemberg/15/3996-befuerchtungen-im-zusammenhang-mit-den-veraenderungen-bei-der-kriminalpolizei-im-zuge-der-polizeistrukturreform,15,3996,Befürchtungen im Zusammenhang mit den Veränderungen bei der Kriminalpolizei im Zuge der Polizeistrukturreform,minor,2013-09-02,Baden-Württemberg,FDP/DVP,Hans-Ulrich Rülke,"Ministerium für Inneres, Digitalisierung und Migration"
1189,https://kleineanfragen.de/baden-wuerttemberg/15/3993-ortsumfahrung-neckarhausen-bundesstrasse-b-297,15,3993,Ortsumfahrung Neckarhausen Bundesstraße (B) 297,minor,2013-09-02,Baden-Württemberg,CDU,Thaddäus Kunzmann,Ministerium für Verkehr und Infrastruktur
1190,https://kleineanfragen.de/baden-wuerttemberg/15/3992-ausbau-der-bundesstrasse-b-27-zwischen-dem-echterdinger-ei-und-aichtal,15,3992,Ausbau der Bundesstraße (B) 27 zwischen dem Echterdinger Ei und Aichtal,minor,2013-09-02,Baden-Württemberg,CDU,Thaddäus Kunzmann,Ministerium für Verkehr und Infrastruktur
1191,https://kleineanfragen.de/baden-wuerttemberg/15/3991-2-meter-regel-fuer-radfahrer-in-den-waeldern-baden-wuerttembergs,15,3991,„2-Meter-Regel“ für Radfahrer in den Wäldern Baden-Württembergs,minor,2013-09-02,Baden-Württemberg,CDU,Stefan Teufel,Ministerium für Verkehr und Infrastruktur;Ministerium für Ländlichen Raum und Verbraucherschutz
1192,https://kleineanfragen.de/baden-wuerttemberg/15/3987-zuschuesse-fuer-sport-und-gesundheitskurse,15,3987,Zuschüsse für Sport- und Gesundheitskurse,minor,2013-08-30,Baden-Württemberg,CDU,Thaddäus Kunzmann,"Ministerium für Finanzen und Wirtschaft;Ministerium für Kultus, Jugend und Sport"
1193,https://kleineanfragen.de/baden-wuerttemberg/15/3979-krebsbachtalbahn-ausflugszug-mit-entwicklungspotenzial,15,3979,Krebsbachtalbahn – Ausflugszug mit Entwicklungspotenzial,minor,2013-08-27,Baden-Württemberg,CDU,Friedlinde Gurr-Hirsch;Elke Brunnemer,Ministerium für Ländlichen Raum und Verbraucherschutz;Ministerium für Verkehr und Infrastruktur
1194,https://kleineanfragen.de/baden-wuerttemberg/15/3978-hagelschaeden-im-landkreis-esslingen-und-der-einsatz-von-hagelfliegern,15,3978,Hagelschäden im Landkreis Esslingen und der Einsatz von Hagelfliegern,minor,2013-08-27,Baden-Württemberg,CDU,Thaddäus Kunzmann,Ministerium für Ländlichen Raum und Verbraucherschutz
1195,https://kleineanfragen.de/baden-wuerttemberg/15/3962-wertschoepfung-und-arbeitsplaetze-im-laendlichen-raum-in-baden-wuerttemberg-potenziale-voraussetzungen-und,15,3962,"Wertschöpfung und Arbeitsplätze im ländlichen Raum in Baden-Württemberg: Potenziale, Voraussetzungen und Maßnahmen der Landesregierung",major,2013-08-27,Baden-Württemberg,Die Grünen,,Landesregierung
1196,https://kleineanfragen.de/baden-wuerttemberg/15/3958-foerderung-radwegebau,15,3958,Förderung Radwegebau,minor,2013-08-20,Baden-Württemberg,CDU,Willi Stächele;Volker Schebesta;Helmut Rau,Ministerium für Verkehr und Infrastruktur
1197,https://kleineanfragen.de/baden-wuerttemberg/15/3948-neubau-eines-gemeinsamen-feuerwehrgeraetehauses-fuer-leupolz-und-karsee-stadt-wangen-im-allgaeu,15,3948,"Neubau eines gemeinsamen Feuerwehrgerätehauses für Leupolz und Karsee, Stadt Wangen im Allgäu",minor,2013-08-16,Baden-Württemberg,CDU,Paul Locherer,"Ministerium für Inneres, Digitalisierung und Migration"
1198,https://kleineanfragen.de/baden-wuerttemberg/15/3944-gewaltambulanzen-und-ihre-bedeutung-fuer-opfer-von-sexual-und-oder-gewaltdelikten,15,3944,Gewaltambulanzen und ihre Bedeutung für Opfer von Sexual- und/oder Gewaltdelikten,minor,2013-08-14,Baden-Württemberg,SPD,Rita Haller-Haid,"Ministerium für Wissenschaft, Forschung und Kunst"
1199,https://kleineanfragen.de/baden-wuerttemberg/15/3942-fsj-plaetze-freiwilliges-soziales-jahr-im-bereich-pflege-in-baden-wuerttemberg,15,3942,FSJ-Plätze (Freiwilliges Soziales Jahr) im Bereich Pflege in Baden-Württemberg,minor,2013-08-14,Baden-Württemberg,CDU,Werner Raab,"Ministerium für Wissenschaft, Forschung und Kunst;Ministerium für Arbeit und Sozialordnung, Familie, Frauen und Senioren"
1200,https://kleineanfragen.de/baden-wuerttemberg/15/3941-ausbau-breitbandversorgung-im-landkreis-karlsruhe,15,3941,Ausbau Breitbandversorgung im Landkreis Karlsruhe,minor,2013-08-14,Baden-Württemberg,CDU,Heribert Rech;Joachim Kößler;Werner Raab,Ministerium für Ländlichen Raum und Verbraucherschutz
1201,https://kleineanfragen.de/baden-wuerttemberg/15/3940-landeseigene-grundstuecke-im-landkreis-esslingen,15,3940,Landeseigene Grundstücke im Landkreis Esslingen,minor,2013-08-14,Baden-Württemberg,CDU,Thaddäus Kunzmann,Ministerium für Finanzen und Wirtschaft
1202,https://kleineanfragen.de/baden-wuerttemberg/15/3939-schulverbuende,15,3939,Schulverbünde,minor,2013-08-13,Baden-Württemberg,CDU,Georg Wacker,"Ministerium für Kultus, Jugend und Sport"
1203,https://kleineanfragen.de/baden-wuerttemberg/15/3937-berechnung-des-fachs-religion-im-gesamtdurchschnitt-der-fachhochschulreife,15,3937,Berechnung des Fachs „Religion“ im Gesamtdurchschnitt der Fachhochschulreife,minor,2013-08-13,Baden-Württemberg,CDU,Viktoria Schmid,"Ministerium für Kultus, Jugend und Sport"
1204,https://kleineanfragen.de/baden-wuerttemberg/15/3933-evaluierung-der-freiburger-sportmedizin-hinsichtlich-ihrer-dopingvergangenheit-durch-die-evaluierungskommission-der,15,3933,Evaluierung der Freiburger Sportmedizin hinsichtlich ihrer Dopingvergangenheit durch die Evaluierungskommission der Freiburger Sportmedizin,minor,2013-08-13,Baden-Württemberg,SPD,Gabi Rolland,"Ministerium für Wissenschaft, Forschung und Kunst"
1205,https://kleineanfragen.de/baden-wuerttemberg/15/3924-fuchsbandwurm-lage-in-baden-wuerttemberg,15,3924,Fuchsbandwurm – Lage in Baden-Württemberg,minor,2013-08-07,Baden-Württemberg,FDP/DVP,Dr. Friedrich Bullinger,"Ministerium für Arbeit und Sozialordnung, Familie, Frauen und Senioren;Ministerium für Ländlichen Raum und Verbraucherschutz"
1206,https://kleineanfragen.de/baden-wuerttemberg/15/3923-umsetzung-der-schlaganfallversorgung-und-investitionsfoerderung-in-baden-wuerttemberg,15,3923,Umsetzung der Schlaganfallversorgung und Investitionsförderung in Baden-Württemberg,minor,2013-08-07,Baden-Württemberg,CDU,Wolfgang Reuther;Klaus Burger,"Ministerium für Arbeit und Sozialordnung, Familie, Frauen und Senioren"
