,html_url,legislative_term,reference,title,interpellation_type,published_at,body,inquiring_parties_wikidata,inquiring_people_wikidata,answering_ministries_wikidata
1624,https://kleineanfragen.de/baden-wuerttemberg/15/2422-tourismus-im-landkreis-freudenstadt,15,2422,Tourismus im Landkreis Freudenstadt,minor,2012-10-01,Baden-Württemberg,FDP/DVP,Timm Kern,Ministerium für Ländlichen Raum und Verbraucherschutz
1625,https://kleineanfragen.de/baden-wuerttemberg/15/2421-situation-der-studienanfaenger-in-heidelberg-bau-von-studentischem-wohnraum,15,2421,Situation der Studienanfänger in Heidelberg/Bau von studentischem Wohnraum,minor,2012-10-01,Baden-Württemberg,CDU,Karl Klein,"Ministerium für Wissenschaft, Forschung und Kunst"
1626,https://kleineanfragen.de/baden-wuerttemberg/15/2416-ortsumfahrung-unlingen-im-zuge-der-b-311,15,2416,Ortsumfahrung Unlingen im Zuge der B 311,minor,2012-09-28,Baden-Württemberg,CDU,Peter Schneider,Ministerium für Verkehr und Infrastruktur
1627,https://kleineanfragen.de/baden-wuerttemberg/15/2415-situation-der-fachschulen-fuer-landwirtschaft-in-oberschwaben,15,2415,Situation der Fachschulen für Landwirtschaft in Oberschwaben,minor,2012-09-28,Baden-Württemberg,CDU,Karl Traub;Peter Schneider;Ulrich Müller;Paul Locherer;Klaus Burger;Rudolf Köberle,Ministerium für Ländlichen Raum und Verbraucherschutz
1628,https://kleineanfragen.de/baden-wuerttemberg/15/2414-landesstrassenbau-im-landkreis-biberach,15,2414,Landesstraßenbau im Landkreis Biberach,minor,2012-09-28,Baden-Württemberg,CDU,Paul Locherer;Peter Schneider,Ministerium für Verkehr und Infrastruktur
1629,https://kleineanfragen.de/baden-wuerttemberg/15/2413-situation-der-hofuebergabe-im-landkreis-waldshut-sowie-in-den-staedten-rheinfelden-und-schwoerstadt,15,2413,Situation der Hofübergabe im Landkreis Waldshut sowie in den Städten Rheinfelden und Schwörstadt,minor,2012-09-28,Baden-Württemberg,CDU,Felix Schreiner,Ministerium für Ländlichen Raum und Verbraucherschutz
1630,https://kleineanfragen.de/baden-wuerttemberg/15/2408-zustaende-in-der-zentralen-aufnahmestelle-fuer-asylbewerber-zast-in-karlsruhe,15,2408,Zustände in der Zentralen Aufnahmestelle für Asylbewerber (ZASt) in Karlsruhe,minor,2012-09-28,Baden-Württemberg,CDU,Katrin Schütz,Ministerium für Integration
1631,https://kleineanfragen.de/baden-wuerttemberg/15/2192-eigenkapitalausstattung-von-unternehmen,15,2192,Eigenkapitalausstattung von Unternehmen,minor,2012-09-28,Baden-Württemberg,CDU,Karl Rombach,Ministerium für Finanzen und Wirtschaft
1632,https://kleineanfragen.de/baden-wuerttemberg/15/2064-strassenbau-und-oeffentlicher-personennahverkehr-oepnv-im-landkreis-karlsruhe,15,2064,Straßenbau und öffentlicher Personennahverkehr (ÖPNV) im Landkreis Karlsruhe,minor,2012-09-28,Baden-Württemberg,CDU,Joachim Kößler;Heribert Rech;Werner Raab,Ministerium für Verkehr und Infrastruktur
1633,https://kleineanfragen.de/baden-wuerttemberg/15/2406-geplante-initiative-der-landesregierung-zur-weiteren-absenkung-des-grenzwerts-fuer-co2-emissionen-neuer,15,2406,Geplante Initiative der Landesregierung zur weiteren Absenkung des Grenzwerts für CO2-Emissionen neuer Personenkraftwagen,minor,2012-09-27,Baden-Württemberg,FDP/DVP,Jochen Haußmann,"Ministerium für Umwelt, Klima und Energiewirtschaft;Ministerium für Verkehr und Infrastruktur"
1634,https://kleineanfragen.de/baden-wuerttemberg/15/2405-breitbandversorgung-im-landkreis-freudenstadt,15,2405,Breitbandversorgung im Landkreis Freudenstadt,minor,2012-09-27,Baden-Württemberg,FDP/DVP,Timm Kern,Ministerium für Ländlichen Raum und Verbraucherschutz
1635,https://kleineanfragen.de/baden-wuerttemberg/15/2382-dachmarke-allgaeu,15,2382,Dachmarke Allgäu,minor,2012-09-25,Baden-Württemberg,CDU,Paul Locherer,Ministerium für Finanzen und Wirtschaft
1636,https://kleineanfragen.de/baden-wuerttemberg/15/2380-entwicklungsprogramm-laendlicher-raum-wahlkreis-weinheim,15,2380,Entwicklungsprogramm Ländlicher Raum - Wahlkreis Weinheim,minor,2012-09-24,Baden-Württemberg,CDU,Georg Wacker,Ministerium für Ländlichen Raum und Verbraucherschutz
1637,https://kleineanfragen.de/baden-wuerttemberg/15/2364-bundesautobahn-6-anschlussstelle-wiesloch-rauenberg-autobahn-kreuz-weinsberg,15,2364,"Bundesautobahn 6, Anschlussstelle Wiesloch/Rauenberg – Autobahn-kreuz Weinsberg",minor,2012-09-21,Baden-Württemberg,CDU,Karl Klein;Elke Brunnemer,Ministerium für Verkehr und Infrastruktur
1638,https://kleineanfragen.de/baden-wuerttemberg/15/2367-aus-fuer-das-hafenkonzert-programmstruktur-des-swr-4,15,2367,Aus für das Hafenkonzert – Programmstruktur des SWR 4,minor,2012-09-19,Baden-Württemberg,CDU,Klaus Burger;Peter Schneider;Karl Traub;Rudolf Köberle;Paul Locherer,Staatsministerium
1639,https://kleineanfragen.de/baden-wuerttemberg/15/2366-angebot-an-pendler-fuer-freie-bahnfahrten-ueber-den-rhein-am-22-august-2012,15,2366,Angebot an Pendler für freie Bahnfahrten über den Rhein am 22. August 2012,minor,2012-09-19,Baden-Württemberg,CDU,Manfred Groh,Ministerium für Verkehr und Infrastruktur
1640,https://kleineanfragen.de/baden-wuerttemberg/15/2365-laermschutzmassnahmen-an-der-autobahn-5-auf-hoehe-von-karlsruhe-killisfeld,15,2365,Lärmschutzmaßnahmen an der Autobahn 5 auf Höhe von Karlsruhe Killisfeld,minor,2012-09-19,Baden-Württemberg,CDU,Manfred Groh,Ministerium für Verkehr und Infrastruktur
1641,https://kleineanfragen.de/baden-wuerttemberg/15/2354-steinschlag-an-bundes-und-landesstrassen-in-pforzheim-und-dem-enzkreis,15,2354,Steinschlag an Bundes- und Landesstraßen in Pforzheim und dem Enzkreis,minor,2012-09-19,Baden-Württemberg,FDP/DVP,Hans-Ulrich Rülke,Ministerium für Verkehr und Infrastruktur
1642,https://kleineanfragen.de/baden-wuerttemberg/15/2353-unzuverlaessigkeit-des-stadtbahnverkehrs-in-pforzheim-und-dem-enzkreis,15,2353,Unzuverlässigkeit des Stadtbahnverkehrs in Pforzheim und dem Enzkreis,minor,2012-09-19,Baden-Württemberg,FDP/DVP,Hans-Ulrich Rülke,Ministerium für Verkehr und Infrastruktur
1643,https://kleineanfragen.de/baden-wuerttemberg/15/2348-haben-die-schulen-im-laendlichen-raum-noch-eine-zukunft,15,2348,Haben die Schulen im ländlichen Raum noch eine Zukunft?,major,2012-09-18,Baden-Württemberg,CDU,,Landesregierung
1644,https://kleineanfragen.de/baden-wuerttemberg/15/2339-atomausstieg-schweiz-atomkraftwerke-beznau-und-leibstadt,15,2339,Atomausstieg Schweiz – Atomkraftwerke Beznau und Leibstadt,minor,2012-09-17,Baden-Württemberg,CDU,Felix Schreiner,"Ministerium für Umwelt, Klima und Energiewirtschaft"
1645,https://kleineanfragen.de/baden-wuerttemberg/15/2338-lehrerversorgung-in-pforzheim-enzkreis,15,2338,Lehrerversorgung in Pforzheim/Enzkreis,minor,2012-09-17,Baden-Württemberg,CDU,Viktoria Schmid,"Ministerium für Kultus, Jugend und Sport"
1646,https://kleineanfragen.de/baden-wuerttemberg/15/2196-breitbandversorgung-im-landkreis-esslingen,15,2196,Breitbandversorgung im Landkreis Esslingen,minor,2012-09-13,Baden-Württemberg,CDU,Andreas Deuschle,Ministerium für Ländlichen Raum und Verbraucherschutz
1647,https://kleineanfragen.de/baden-wuerttemberg/15/2195-schulen-im-landkreis-esslingen,15,2195,Schulen im Landkreis Esslingen,minor,2012-09-12,Baden-Württemberg,CDU,Thaddäus Kunzmann,"Ministerium für Kultus, Jugend und Sport"
1648,https://kleineanfragen.de/baden-wuerttemberg/15/2303-die-anerkennung-des-realschulabschlusses-nach-erfolgreicher-berufsausbildung,15,2303,Die Anerkennung des Realschulabschlusses nach erfolgreicher Berufsausbildung,minor,2012-09-11,Baden-Württemberg,SPD,Christoph Bayer,"Ministerium für Kultus, Jugend und Sport"
1649,https://kleineanfragen.de/baden-wuerttemberg/15/2301-geodatenbasierte-online-plattform-fuer-hinweise-aus-der-buergerschaft,15,2301,Geodatenbasierte Online-Plattform für Hinweise aus der Bürgerschaft,minor,2012-09-10,Baden-Württemberg,Die Grünen,Alexander Salomon,"Ministerium für Inneres, Digitalisierung und Migration"
1650,https://kleineanfragen.de/baden-wuerttemberg/15/2300-intervalle-fuer-die-ueberpruefung-von-skiliften-schleppliften-und-seilbahnen,15,2300,"Intervalle für die Überprüfung von Skiliften, Schleppliften und Seilbahnen",minor,2012-09-10,Baden-Württemberg,FDP/DVP,Hans-Ulrich Rülke,Ministerium für Verkehr und Infrastruktur
1651,https://kleineanfragen.de/baden-wuerttemberg/15/2299-lehrer-und-unterrichtsversorgung-an-den-schulen-im-rems-murr-kreis,15,2299,Lehrer- und Unterrichtsversorgung an den Schulen im Rems-Murr-Kreis,minor,2012-09-10,Baden-Württemberg,FDP/DVP,Jochen Haußmann,"Ministerium für Kultus, Jugend und Sport"
1652,https://kleineanfragen.de/baden-wuerttemberg/15/2206-spannungsverhaeltnis-von-denkmalschutz-und-behindertengerechten-kulturdenkmaelern,15,2206,Spannungsverhältnis von Denkmalschutz und behindertengerechten Kulturdenkmälern?,minor,2012-09-10,Baden-Württemberg,CDU,Werner Raab;Dieter Hillebrand,Ministerium für Finanzen und Wirtschaft
1653,https://kleineanfragen.de/baden-wuerttemberg/15/2203-staatsvertrag-zwischen-deutschland-und-der-schweiz-zur-regelung-des-flugverkehrs,15,2203,Staatsvertrag zwischen Deutschland und der Schweiz zur Regelung des Flugverkehrs,minor,2012-09-10,Baden-Württemberg,CDU,Guido Wolf;Felix Schreiner,Ministerium für Verkehr und Infrastruktur
1654,https://kleineanfragen.de/baden-wuerttemberg/15/2202-umgehungsstrasse-leingarten-l-1105-und-saarlandstrasse-heilbronn,15,2202,Umgehungsstraße Leingarten L 1105 und Saarlandstraße Heilbronn,minor,2012-09-10,Baden-Württemberg,CDU,Alexander Throm,Ministerium für Verkehr und Infrastruktur
1655,https://kleineanfragen.de/baden-wuerttemberg/15/2191-einrichtung-eines-musikgymnasiums-in-trossingen,15,2191,Einrichtung eines Musikgymnasiums in Trossingen,minor,2012-09-10,Baden-Württemberg,CDU,Guido Wolf,"Ministerium für Wissenschaft, Forschung und Kunst;Ministerium für Kultus, Jugend und Sport"
1656,https://kleineanfragen.de/baden-wuerttemberg/15/2295-zustand-bzw-neubau-eines-gruenen-bahnhofs-in-crailsheim,15,2295,Zustand bzw. Neubau eines grünen Bahnhofs in Crailsheim,minor,2012-09-06,Baden-Württemberg,FDP/DVP,Dr. Friedrich Bullinger,Ministerium für Verkehr und Infrastruktur
1657,https://kleineanfragen.de/baden-wuerttemberg/15/2294-ausbau-reparatur-l-1050-pfedelbach-mainhardt-oberrot,15,2294,Ausbau/Reparatur L 1050 Pfedelbach/Mainhardt/Oberrot,minor,2012-09-06,Baden-Württemberg,FDP/DVP,Dr. Friedrich Bullinger,Ministerium für Verkehr und Infrastruktur
1658,https://kleineanfragen.de/baden-wuerttemberg/15/2204-strassenbau-im-wahlkreis-tuttlingen-donaueschingen,15,2204,Straßenbau im Wahlkreis Tuttlingen-Donaueschingen,minor,2012-09-06,Baden-Württemberg,CDU,Guido Wolf,Ministerium für Verkehr und Infrastruktur
1659,https://kleineanfragen.de/baden-wuerttemberg/15/2291-laermschutzmassnahmen-im-zuge-des-ausbaus-der-bundesautobahn-bab-8-im-enzkreis,15,2291,Lärmschutzmaßnahmen im Zuge des Ausbaus der Bundesautobahn (BAB) 8 im Enzkreis,minor,2012-09-05,Baden-Württemberg,FDP/DVP,Hans-Ulrich Rülke,Ministerium für Verkehr und Infrastruktur
1660,https://kleineanfragen.de/baden-wuerttemberg/15/2290-klimaschutzgesetz-und-nationalpark-nordschwarzwald,15,2290,Klimaschutzgesetz und Nationalpark Nordschwarzwald,minor,2012-09-05,Baden-Württemberg,CDU,Karl-Wolfgang Jägel,"Ministerium für Umwelt, Klima und Energiewirtschaft"
1661,https://kleineanfragen.de/baden-wuerttemberg/15/2205-umweltverbund-und-oeffentlicher-personennahverkehr-oepnv-im-wahlkreis-tuttlingen-donaueschingen,15,2205,Umweltverbund und Öffentlicher Personennahverkehr (ÖPNV) im Wahlkreis Tuttlingen-Donaueschingen,minor,2012-09-05,Baden-Württemberg,CDU,Guido Wolf,Ministerium für Verkehr und Infrastruktur
1662,https://kleineanfragen.de/baden-wuerttemberg/15/2287-zukunft-des-projekts-integration-durch-sport,15,2287,Zukunft des Projekts „Integration durch Sport“,minor,2012-09-04,Baden-Württemberg,FDP/DVP,Andreas Glück,"Ministerium für Integration;Ministerium für Kultus, Jugend und Sport"
1663,https://kleineanfragen.de/baden-wuerttemberg/15/2201-wohnkonzept-der-landesheimbauverordnung,15,2201,Wohnkonzept der Landesheimbauverordnung,minor,2012-09-04,Baden-Württemberg,SPD,Gerhard Kleinböck,"Ministerium für Arbeit und Sozialordnung, Familie, Frauen und Senioren"
1664,https://kleineanfragen.de/baden-wuerttemberg/15/2194-regionale-planung-der-schulstruktur-im-mittelbereich-bretten-auswirkungen-der-gemeinschaftsschulen-auf-den-bestand,15,2194,Regionale Planung der Schulstruktur im Mittelbereich Bretten – Auswirkungen der Gemeinschaftsschulen auf den Bestand der Schulen,minor,2012-09-04,Baden-Württemberg,CDU,Joachim Kößler,"Ministerium für Kultus, Jugend und Sport"
1665,https://kleineanfragen.de/baden-wuerttemberg/15/2193-aktivitaeten-sogenannter-sekten-und-psychogruppen,15,2193,Aktivitäten sogenannter Sekten und Psychogruppen,minor,2012-09-03,Baden-Württemberg,SPD,Thomas Reusch-Frey,"Ministerium für Kultus, Jugend und Sport"
1666,https://kleineanfragen.de/baden-wuerttemberg/15/2285-aufkommen-und-verwendung-der-mittel-aus-der-abgabe-fuer-klimaneutrales-fliegen,15,2285,Aufkommen und Verwendung der Mittel aus der Abgabe für klimaneutrales Fliegen,minor,2012-08-31,Baden-Württemberg,FDP/DVP,Dr. Friedrich Bullinger,"Ministerium für Umwelt, Klima und Energiewirtschaft"
1667,https://kleineanfragen.de/baden-wuerttemberg/15/2284-touristische-bedeutung-und-foerderung-der-reaktivierung-der-nebenbahn-blaufelden-gerabronn-langenburg,15,2284,Touristische Bedeutung und Förderung der Reaktivierung der Nebenbahn Blaufelden – Gerabronn – Langenburg,minor,2012-08-31,Baden-Württemberg,FDP/DVP,Dr. Friedrich Bullinger,"Ministerium für Finanzen und Wirtschaft;Ministerium für Kultus, Jugend und Sport;Ministerium für Ländlichen Raum und Verbraucherschutz;Ministerium für Verkehr und Infrastruktur"
1668,https://kleineanfragen.de/baden-wuerttemberg/15/2278-umleitungsmassnahmen-im-zuge-von-bundesstrassensanierungen-im-enzkreis,15,2278,Umleitungsmaßnahmen im Zuge von Bundesstraßensanierungen im Enzkreis,minor,2012-08-30,Baden-Württemberg,FDP/DVP,Hans-Ulrich Rülke,Ministerium für Verkehr und Infrastruktur
1669,https://kleineanfragen.de/baden-wuerttemberg/15/2277-ergaenzungsbereich-an-grundschulen,15,2277,Ergänzungsbereich an Grundschulen,minor,2012-08-30,Baden-Württemberg,CDU,Alexander Throm,"Ministerium für Kultus, Jugend und Sport"
1670,https://kleineanfragen.de/baden-wuerttemberg/15/2276-breitbandversorgung-im-alb-donau-kreis,15,2276,Breitbandversorgung im Alb-Donau-Kreis,minor,2012-08-30,Baden-Württemberg,CDU,Karl Traub,Ministerium für Ländlichen Raum und Verbraucherschutz
1671,https://kleineanfragen.de/baden-wuerttemberg/15/2275-lehrerversorgung-an-den-schulen-des-landkreises-sigmaringen,15,2275,Lehrerversorgung an den Schulen des Landkreises Sigmaringen,minor,2012-08-30,Baden-Württemberg,CDU,Klaus Burger,"Ministerium für Kultus, Jugend und Sport"
1672,https://kleineanfragen.de/baden-wuerttemberg/15/2273-verbesserung-der-bahninfrastruktur-bei-der-tauber-und-hohenlohebahn,15,2273,Verbesserung der Bahninfrastruktur bei der Tauber- und Hohenlohebahn,minor,2012-08-30,Baden-Württemberg,FDP/DVP,Dr. Friedrich Bullinger,Ministerium für Verkehr und Infrastruktur
1673,https://kleineanfragen.de/baden-wuerttemberg/15/2268-funktion-und-zustand-des-kocher-stausees-in-schwaebisch-hall-steinbach,15,2268,Funktion und Zustand des Kocher-Stausees in Schwäbisch Hall- Steinbach,minor,2012-08-30,Baden-Württemberg,FDP/DVP,Dr. Friedrich Bullinger,"Ministerium für Ländlichen Raum und Verbraucherschutz;Ministerium für Umwelt, Klima und Energiewirtschaft"
1674,https://kleineanfragen.de/baden-wuerttemberg/15/2269-verkehrssicherheit-und-massnahmen-an-der-kreuzung-l-1040-k-2500-kirchberg-jagst-herbolzhausen,15,2269,Verkehrssicherheit und Maßnahmen an der Kreuzung L 1040/K 2500 Kirchberg/Jagst-Herbolzhausen,minor,2012-08-28,Baden-Württemberg,FDP/DVP,Dr. Friedrich Bullinger,Ministerium für Verkehr und Infrastruktur
1675,https://kleineanfragen.de/baden-wuerttemberg/15/2266-ausbau-des-radwegenetzes-im-landkreis-konstanz-und-in-der-bodenseeregion,15,2266,Ausbau des Radwegenetzes im Landkreis Konstanz und in der Bodenseeregion,minor,2012-08-27,Baden-Württemberg,Die Grünen,Siegfried Lehmann,Ministerium für Verkehr und Infrastruktur
1676,https://kleineanfragen.de/baden-wuerttemberg/15/2263-verbot-und-entziehung-der-gemeinnuetzigkeit-extremistischer-vereine,15,2263,Verbot und Entziehung der Gemeinnützigkeit extremistischer Vereine,minor,2012-08-22,Baden-Württemberg,CDU,Bernhard Lasotta,"Ministerium für Inneres, Digitalisierung und Migration"
1677,https://kleineanfragen.de/baden-wuerttemberg/15/2262-entwicklung-des-beitrags-der-volkshochschulen-zum-thema-integration,15,2262,Entwicklung des Beitrags der Volkshochschulen zum Thema Integration,minor,2012-08-22,Baden-Württemberg,CDU,Bernhard Lasotta,Ministerium für Integration
1678,https://kleineanfragen.de/baden-wuerttemberg/15/2261-zivilklauseln-und-ethikkommissionen-der-hochschulen-des-landes,15,2261,Zivilklauseln und Ethikkommissionen der Hochschulen des Landes,minor,2012-08-22,Baden-Württemberg,Die Grünen,Alexander Salomon,"Ministerium für Wissenschaft, Forschung und Kunst"
1679,https://kleineanfragen.de/baden-wuerttemberg/15/2242-lehrerversorgung-an-den-schulen-im-kreis-freudenstadt,15,2242,Lehrerversorgung an den Schulen im Kreis Freudenstadt,minor,2012-08-20,Baden-Württemberg,CDU,Norbert Beck,"Ministerium für Kultus, Jugend und Sport"
1680,https://kleineanfragen.de/baden-wuerttemberg/15/2241-lehrerversorgung-an-den-schulen-im-kreis-calw,15,2241,Lehrerversorgung an den Schulen im Kreis Calw,minor,2012-08-20,Baden-Württemberg,CDU,Thomas Blenke,"Ministerium für Kultus, Jugend und Sport"
1681,https://kleineanfragen.de/baden-wuerttemberg/15/2240-nachhaltige-mobilitaet-in-baden-wuerttemberg-voranbringen-fuer-mensch-wirt-schaft-und-umwelt,15,2240,"Nachhaltige Mobilität in Baden-Württemberg voranbringen – für Mensch, Wirt-schaft und Umwelt",major,2012-08-17,Baden-Württemberg,Die Grünen,,Landesregierung
1682,https://kleineanfragen.de/baden-wuerttemberg/15/2239-wiederaufnahme-der-verhandlungen-ueber-die-lehrkraefte-entgeltordnung-l-ego-durch-die-tarifgemeinschaft-deutscher,15,2239,Wiederaufnahme der Verhandlungen über die Lehrkräfte-Entgeltordnung (L-EGO) durch die Tarifgemeinschaft deutscher Länder (TdL),minor,2012-08-15,Baden-Württemberg,Die Grünen,Sandra Boser;Thomas Poreski,Ministerium für Finanzen und Wirtschaft
1683,https://kleineanfragen.de/baden-wuerttemberg/15/2237-kuenftige-entwicklung-der-impfraten-und-der-versorgung-mit-impfstoffen,15,2237,Künftige Entwicklung der Impfraten und der Versorgung mit Impfstoffen,minor,2012-08-15,Baden-Württemberg,CDU,Bernhard Lasotta,"Ministerium für Arbeit und Sozialordnung, Familie, Frauen und Senioren"
1684,https://kleineanfragen.de/baden-wuerttemberg/15/2004-bearbeitung-von-anfragen-von-buergerinnen-und-buergern-zum-themenbereich-sekten-und-psychogruppen-scientology,15,2004,Bearbeitung von Anfragen von Bürgerinnen und Bürgern zum Themenbereich Sekten und Psychogruppen/Scientology,minor,2012-08-15,Baden-Württemberg,CDU,Tobias Wald,"Ministerium für Kultus, Jugend und Sport"
1685,https://kleineanfragen.de/baden-wuerttemberg/15/2236-sachstand-lehrerversorgung-an-den-schulen-des-landkreises-waldshut-in-rheinfelden-und-schwoerstadt,15,2236,"Sachstand Lehrerversorgung an den Schulen des Landkreises Waldshut, in Rheinfelden und Schwörstadt",minor,2012-08-14,Baden-Württemberg,CDU,Felix Schreiner,"Ministerium für Kultus, Jugend und Sport"
1686,https://kleineanfragen.de/baden-wuerttemberg/15/2228-unterrichtsfach-lebens-und-alltagskompetenzen,15,2228,Unterrichtsfach „Lebens- und Alltagskompetenzen“,minor,2012-08-13,Baden-Württemberg,CDU,Friedlinde Gurr-Hirsch,"Ministerium für Kultus, Jugend und Sport"
1687,https://kleineanfragen.de/baden-wuerttemberg/15/2227-entwicklung-swr-standort-baden-baden,15,2227,Entwicklung SWR-Standort Baden-Baden,minor,2012-08-13,Baden-Württemberg,CDU,Tobias Wald,Staatsministerium
1688,https://kleineanfragen.de/baden-wuerttemberg/15/2225-anerkennung-von-fahrzeughaltern-als-land-oder-forstwirtschaftlicher-betrieb,15,2225,Anerkennung von Fahrzeughaltern als land- oder forstwirtschaftlicher Betrieb,minor,2012-08-10,Baden-Württemberg,FDP/DVP,Hans-Ulrich Rülke,Ministerium für Finanzen und Wirtschaft
1689,https://kleineanfragen.de/baden-wuerttemberg/15/2224-kostenerfassung-im-rahmen-der-vorbereitungen-zur-polizeistrukturreform,15,2224,Kostenerfassung im Rahmen der Vorbereitungen zur Polizeistrukturreform,minor,2012-08-09,Baden-Württemberg,FDP/DVP,Dr. Friedrich Bullinger,"Ministerium für Inneres, Digitalisierung und Migration"
1690,https://kleineanfragen.de/baden-wuerttemberg/15/2221-strassenbau-und-oeffentlicher-personennahverkehr-oepnv-im-landkreis-rottweil,15,2221,Straßenbau und öffentlicher Personennahverkehr (ÖPNV) im Landkreis Rottweil,minor,2012-08-08,Baden-Württemberg,CDU,Stefan Teufel,Ministerium für Verkehr und Infrastruktur
1691,https://kleineanfragen.de/baden-wuerttemberg/15/1992-moegliche-s-bahn-verbindungen-zum-flughafen,15,1992,Mögliche S-Bahn-Verbindungen zum Flughafen,minor,2012-08-07,Baden-Württemberg,CDU,Thaddäus Kunzmann,Ministerium für Verkehr und Infrastruktur
1692,https://kleineanfragen.de/baden-wuerttemberg/15/2003-grundschulempfehlung-und-besuch-der-weiterfuehrenden-schulen,15,2003,Grundschulempfehlung und Besuch der weiterführenden Schulen,minor,2012-08-03,Baden-Württemberg,CDU,Thaddäus Kunzmann,"Ministerium für Kultus, Jugend und Sport"
1693,https://kleineanfragen.de/baden-wuerttemberg/15/2001-schallschutzwaende-im-stadtgebiet-geislingen-steige-an-der-eisenbahnstrecke-stuttgart-ulm,15,2001,Schallschutzwände im Stadtgebiet Geislingen/Steige an der Eisenbahnstrecke Stuttgart–Ulm,minor,2012-08-03,Baden-Württemberg,SPD,Sascha Binder,Ministerium für Verkehr und Infrastruktur
1694,https://kleineanfragen.de/baden-wuerttemberg/15/2185-umgang-des-statistischen-landesamtes-mit-mittelstaendischen-unternehmen,15,2185,Umgang des Statistischen Landesamtes mit mittelständischen Unternehmen,minor,2012-08-01,Baden-Württemberg,FDP/DVP,Hans-Ulrich Rülke,Ministerium für Finanzen und Wirtschaft
1695,https://kleineanfragen.de/baden-wuerttemberg/15/2184-lehrermangel-an-beruflichen-schulen-in-pforzheim-und-dem-enzkreis,15,2184,Lehrermangel an beruflichen Schulen in Pforzheim und dem Enzkreis,minor,2012-08-01,Baden-Württemberg,FDP/DVP,Hans-Ulrich Rülke,"Ministerium für Kultus, Jugend und Sport"
1696,https://kleineanfragen.de/baden-wuerttemberg/15/2183-erfahrungen-anderer-bundeslaender-mit-landesgesetzlichen-regelungen-fuer-business-improvement-districts,15,2183,Erfahrungen anderer Bundesländer mit landesgesetzlichen Regelungen für Business Improvement Districts,minor,2012-08-01,Baden-Württemberg,SPD,Claus Schmiedel,Ministerium für Finanzen und Wirtschaft
1697,https://kleineanfragen.de/baden-wuerttemberg/15/2174-sanierung-l-511-bahnunterfuehrung-nord-in-lauda-koenigshofen-stadtteil-lauda,15,2174,Sanierung L 511 – Bahnunterführung Nord in Lauda-Königshofen (Stadtteil Lauda),minor,2012-08-01,Baden-Württemberg,SPD,Georg Nelius,Ministerium für Verkehr und Infrastruktur
1698,https://kleineanfragen.de/baden-wuerttemberg/15/2175-breitbandversorgung-im-enzkreis,15,2175,Breitbandversorgung im Enzkreis,minor,2012-07-31,Baden-Württemberg,CDU,Viktoria Schmid,Ministerium für Ländlichen Raum und Verbraucherschutz
1699,https://kleineanfragen.de/baden-wuerttemberg/15/2170-anerkennung-deutscher-kommunen-im-sinne-des-sachplans-geologische-tiefenlager-der-schweiz,15,2170,Anerkennung deutscher Kommunen im Sinne des Sachplans geologische Tiefenlager der Schweiz,minor,2012-07-27,Baden-Württemberg,SPD,Hans-Peter Storz,"Ministerium für Umwelt, Klima und Energiewirtschaft"
1700,https://kleineanfragen.de/baden-wuerttemberg/15/2167-einstellung-des-landes-zu-moeglichkeiten-im-rahmen-bestehender-und-geplanter-melderechtlicher-regelungen,15,2167,Einstellung des Landes zu Möglichkeiten im Rahmen bestehender und geplanter melderechtlicher Regelungen,minor,2012-07-26,Baden-Württemberg,FDP/DVP,Hans-Ulrich Rülke,"Ministerium für Inneres, Digitalisierung und Migration"
1701,https://kleineanfragen.de/baden-wuerttemberg/15/2166-provisorische-fussgaengerverbindungen-waehrend-des-ausbaus-der-bundesautobahn-bab-8-im-enzkreis,15,2166,Provisorische Fußgängerverbindungen während des Ausbaus der Bundesautobahn (BAB) 8 im Enzkreis,minor,2012-07-26,Baden-Württemberg,FDP/DVP,Hans-Ulrich Rülke,Ministerium für Verkehr und Infrastruktur
1702,https://kleineanfragen.de/baden-wuerttemberg/15/2165-errichtung-von-bruecken-an-landesstrassen-im-enzkreis,15,2165,Errichtung von Brücken an Landesstraßen im Enzkreis,minor,2012-07-26,Baden-Württemberg,FDP/DVP,Hans-Ulrich Rülke,Ministerium für Verkehr und Infrastruktur
1703,https://kleineanfragen.de/baden-wuerttemberg/15/2163-innovation-im-wechselspiel-von-wissenschaft-und-wirtschaft,15,2163,Innovation im Wechselspiel von Wissenschaft und Wirtschaft,major,2012-07-26,Baden-Württemberg,FDP/DVP,,Landesregierung
1704,https://kleineanfragen.de/baden-wuerttemberg/15/2162-befreiung-von-hospizen-von-der-rundfunkgebuehrenpflicht,15,2162,Befreiung von Hospizen von der Rundfunkgebührenpflicht,minor,2012-07-26,Baden-Württemberg,CDU,Bernhard Lasotta,"Ministerium für Arbeit und Sozialordnung, Familie, Frauen und Senioren;Staatsministerium"
1705,https://kleineanfragen.de/baden-wuerttemberg/15/2159-auswirkungen-des-bundesverfassungsgerichtsurteils-vom-18-juli-2012-auf-baden-wuerttemberg-lebensunterhalt,15,2159,"Auswirkungen des Bundesverfassungsgerichtsurteils vom 18. Juli 2012 auf Baden-Württemberg – Lebensunterhalt, Leistungsgewährung und Unterbringung für Flüchtlinge",minor,2012-07-25,Baden-Württemberg,Die Grünen,,Ministerium für Integration
