,html_url,legislative_term,reference,title,interpellation_type,published_at,body,inquiring_parties_wikidata,inquiring_people_wikidata,answering_ministries_wikidata
2264,https://kleineanfragen.de/baden-wuerttemberg/16/3452-puenktlichkeit-der-s-4-auf-der-strecke-karlsruhe-heilbronn-oehringen,16,3452,Pünktlichkeit der S 4 auf der Strecke Karlsruhe–Heilbronn–Öhringen,minor,2018-03-07,Baden-Württemberg,FDP/DVP,Nico Weinmann,Ministerium für Verkehr
2265,https://kleineanfragen.de/baden-wuerttemberg/16/3425-hochwasserschutz-im-landkreis-karlsruhe,16,3425,Hochwasserschutz im Landkreis Karlsruhe,minor,2018-03-07,Baden-Württemberg,CDU,Ulli Hockenberger;Christine Neumann;Joachim Kößler,"Ministerium für Umwelt, Klima und Energiewirtschaft"
2266,https://kleineanfragen.de/baden-wuerttemberg/16/3414-altersfeststellungen-durch-ultraschall-handscanner,16,3414,Altersfeststellungen durch Ultraschall-Handscanner,minor,2018-03-07,Baden-Württemberg,AfD,Hans Peter Stauch,"Ministerium für Arbeit und Sozialordnung, Familie, Frauen und Senioren;Ministerium für Inneres, Digitalisierung und Migration;Ministerium für Soziales und Integration"
2267,https://kleineanfragen.de/baden-wuerttemberg/16/3287-veraenderungen-auf-der-gaeubahn-nach-dem-fahrplanwechsel-am-10-dezember-2017,16,3287,Veränderungen auf der Gäubahn nach dem Fahrplanwechsel am 10. Dezember 2017,minor,2018-03-07,Baden-Württemberg,FDP/DVP,Timm Kern,Ministerium für Verkehr
2268,https://kleineanfragen.de/baden-wuerttemberg/16/3445-landesrechtliche-regelungen-zu-privaten-bauvorhaben-ohne-baufortschritt,16,3445,Landesrechtliche Regelungen zu privaten Bauvorhaben ohne Baufortschritt,minor,2018-03-06,Baden-Württemberg,FDP/DVP,Andreas Glück,"Ministerium für Wirtschaft, Arbeit und Wohnungsbau"
2269,https://kleineanfragen.de/baden-wuerttemberg/16/3419-perinatalzentren-level-1-und-universitaets-frauenkliniken,16,3419,Perinatalzentren Level 1 und Universitäts-Frauenkliniken,minor,2018-03-06,Baden-Württemberg,AfD,Thomas Axel Palka,"Ministerium für Arbeit und Sozialordnung, Familie, Frauen und Senioren;Ministerium für Wissenschaft, Forschung und Kunst;Ministerium für Soziales und Integration"
2270,https://kleineanfragen.de/baden-wuerttemberg/16/3410-betreuungsangebote-fuer-schuelerinnen-und-schueler-im-enzkreis,16,3410,Betreuungsangebote für Schülerinnen und Schüler im Enzkreis,minor,2018-03-06,Baden-Württemberg,FDP/DVP,Erik Schweickert,"Ministerium für Kultus, Jugend und Sport"
2271,https://kleineanfragen.de/baden-wuerttemberg/16/3399-puenktlichkeit-und-technischer-zustand-der-bahn-auf-der-hochrheinstrecke,16,3399,Pünktlichkeit und technischer Zustand der Bahn auf der Hochrheinstrecke,minor,2018-03-06,Baden-Württemberg,SPD,Rainer Stickelberger,Ministerium für Verkehr
2272,https://kleineanfragen.de/baden-wuerttemberg/16/3386-breitbandversorgung-wahlkreis-33,16,3386,Breitbandversorgung (Wahlkreis 33),minor,2018-03-06,Baden-Württemberg,CDU,Tobias Wald,"Ministerium für Inneres, Digitalisierung und Migration"
2273,https://kleineanfragen.de/baden-wuerttemberg/16/3374-luftqualitaet-und-luftqualitaetsmessungen-in-den-kommunen-im-landkreis-ludwigsburg,16,3374,Luftqualität und Luftqualitätsmessungen in den Kommunen im Landkreis Ludwigsburg,minor,2018-03-06,Baden-Württemberg,CDU,Fabian Gramling,"Ministerium für Wirtschaft, Arbeit und Wohnungsbau;Ministerium für Verkehr"
2274,https://kleineanfragen.de/baden-wuerttemberg/16/3360-erziehung-zur-friedensliebe-in-baden-wuerttemberg,16,3360,Erziehung zur Friedensliebe in Baden-Württemberg,minor,2018-03-06,Baden-Württemberg,Die Grünen,Willi Halder,"Ministerium für Wissenschaft, Forschung und Kunst;Ministerium für Kultus, Jugend und Sport"
2275,https://kleineanfragen.de/baden-wuerttemberg/16/3351-illegaler-handel-mit-welpen,16,3351,Illegaler Handel mit Welpen,minor,2018-03-06,Baden-Württemberg,AfD,Lars Patrick Berg,"Ministerium für Inneres, Digitalisierung und Migration;Ministerium für Ländlichen Raum und Verbraucherschutz"
2276,https://kleineanfragen.de/baden-wuerttemberg/16/3411-finanzierung-von-betreuungsangeboten-fuer-schuelerinnen-und-schueler-im-enzkreis,16,3411,Finanzierung von Betreuungsangeboten für Schülerinnen und Schüler im Enzkreis,minor,2018-03-05,Baden-Württemberg,FDP/DVP,Erik Schweickert,"Ministerium für Kultus, Jugend und Sport"
2277,https://kleineanfragen.de/baden-wuerttemberg/16/3403-unesco-geopark-schwaebische-alb,16,3403,UNESCO-Geopark Schwäbische Alb,minor,2018-03-05,Baden-Württemberg,SPD,Martin Rivoir,Ministerium für Finanzen;Ministerium für Ländlichen Raum und Verbraucherschutz
2278,https://kleineanfragen.de/baden-wuerttemberg/16/3394-unterbindung-von-mehrfachstraftaten-durch-asylbewerber,16,3394,Unterbindung von Mehrfachstraftaten durch Asylbewerber,minor,2018-03-01,Baden-Württemberg,AfD,Stefan Räpple,"Ministerium für Inneres, Digitalisierung und Migration"
2279,https://kleineanfragen.de/baden-wuerttemberg/16/3393-innerdeutsche-schueleraustauschprogramme-des-landes-baden-wuerttemberg,16,3393,Innerdeutsche Schüleraustauschprogramme des Landes Baden-Württemberg,minor,2018-03-01,Baden-Württemberg,FDP/DVP,Jürgen Keck,"Ministerium für Kultus, Jugend und Sport"
2280,https://kleineanfragen.de/baden-wuerttemberg/16/3390-muttersprachlicher-unterricht-in-baden-wuerttemberg,16,3390,Muttersprachlicher Unterricht in Baden-Württemberg,minor,2018-03-01,Baden-Württemberg,Die Grünen,Sandra Boser,"Ministerium für Finanzen;Ministerium für Kultus, Jugend und Sport"
2281,https://kleineanfragen.de/baden-wuerttemberg/16/3388-einleitung-von-abwasser-in-den-bodensee,16,3388,Einleitung von Abwasser in den Bodensee,minor,2018-03-01,Baden-Württemberg,FDP/DVP,Jürgen Keck;Klaus Hoher,"Ministerium für Umwelt, Klima und Energiewirtschaft"
2282,https://kleineanfragen.de/baden-wuerttemberg/16/3407-was-passiert-mit-den-geldern-des-kommunalen-sanierungsfonds,16,3407,Was passiert mit den Geldern des kommunalen Sanierungsfonds?,minor,2018-02-28,Baden-Württemberg,SPD,Peter Hofelich,"Ministerium für Verkehr;Ministerium für Kultus, Jugend und Sport;Ministerium für Finanzen"
2283,https://kleineanfragen.de/baden-wuerttemberg/16/3352-gruende-und-moegliche-folgen-des-betriebsverbots-fuer-die-weitere-stromerzeugung-des-zweckverbands-wasserversorgung,16,3352,Gründe und mögliche Folgen des Betriebsverbots für die weitere Stromerzeugung des Zweckverbands Wasserversorgung Schwarzbrunnen im Schieberhaus Erzgrube,minor,2018-02-28,Baden-Württemberg,AfD,Klaus Dürr,"Ministerium für Umwelt, Klima und Energiewirtschaft"
2284,https://kleineanfragen.de/baden-wuerttemberg/16/3328-strassenzustand-verkehrssicherheit-und-laermschutz-im-zuge-der-bundesstrasse-b-466-im-abschnitt-bad-ueberkingen-bad,16,3328,"Straßenzustand, Verkehrssicherheit und Lärmschutz im Zuge der Bundesstraße (B) 466 im Abschnitt Bad Überkingen–Bad Überkingen-Hausen",minor,2018-02-28,Baden-Württemberg,CDU,Nicole Razavi,Ministerium für Verkehr
2285,https://kleineanfragen.de/baden-wuerttemberg/16/3269-breitbandversorgung-im-rems-murr-kreis,16,3269,Breitbandversorgung im Rems-Murr-Kreis,minor,2018-02-28,Baden-Württemberg,AfD,Klaus Dürr,"Ministerium für Inneres, Digitalisierung und Migration"
2286,https://kleineanfragen.de/baden-wuerttemberg/16/3373-imkerei-in-baden-wuerttemberg,16,3373,Imkerei in Baden-Württemberg,minor,2018-02-27,Baden-Württemberg,CDU,Sylvia Felder,Ministerium für Ländlichen Raum und Verbraucherschutz
2287,https://kleineanfragen.de/baden-wuerttemberg/16/3289-technisches-meisterstueck-schwarzwaldbahn,16,3289,Technisches Meisterstück Schwarzwaldbahn,minor,2018-02-27,Baden-Württemberg,CDU,Karl Rombach,"Ministerium für Wirtschaft, Arbeit und Wohnungsbau;Ministerium für Verkehr"
2288,https://kleineanfragen.de/baden-wuerttemberg/16/3385-aktueller-sachstand-wehr-und-kanalbruecke-besigheim-l-1115,16,3385,Aktueller Sachstand Wehr- und Kanalbrücke Besigheim (L 1115),minor,2018-02-26,Baden-Württemberg,CDU,Fabian Gramling,Ministerium für Verkehr
2289,https://kleineanfragen.de/baden-wuerttemberg/16/3339-stationaere-geschwindigkeitsueberwachung-in-baden-wuerttemberg,16,3339,Stationäre Geschwindigkeitsüberwachung in Baden-Württemberg,minor,2018-02-26,Baden-Württemberg,SPD,Gerhard Kleinböck,"Ministerium für Inneres, Digitalisierung und Migration;Ministerium für Verkehr"
2290,https://kleineanfragen.de/baden-wuerttemberg/16/3263-digitales-hochgeschwindigkeitsnetz-in-baden-wuerttemberg,16,3263,Digitales Hochgeschwindigkeitsnetz in Baden-Württemberg,major,2018-02-26,Baden-Württemberg,FDP/DVP,,Landesregierung
2291,https://kleineanfragen.de/baden-wuerttemberg/16/3344-rettungstunnel-am-schemelsbergtunnel-an-der-bundesstrasse-b-39-bei-weinsberg,16,3344,Rettungstunnel am Schemelsbergtunnel an der Bundesstraße (B) 39 bei Weinsberg,minor,2018-02-23,Baden-Württemberg,SPD,Reinhold Gall,Ministerium für Verkehr
2292,https://kleineanfragen.de/baden-wuerttemberg/16/3341-bahnstrecke-heilbronn-wuerzburg-frankenbahn,16,3341,Bahnstrecke Heilbronn−Würzburg (Frankenbahn),minor,2018-02-23,Baden-Württemberg,SPD,Georg Nelius,Ministerium für Verkehr
2293,https://kleineanfragen.de/baden-wuerttemberg/16/3288-auszahlung-der-unterbringungskosten-fuer-fluechtlinge,16,3288,Auszahlung der Unterbringungskosten für Flüchtlinge,minor,2018-02-23,Baden-Württemberg,Die Grünen,Reinhold Pix,"Ministerium für Inneres, Digitalisierung und Migration;Ministerium für Finanzen"
2294,https://kleineanfragen.de/baden-wuerttemberg/16/3273-behoerdliche-erfassung-der-terroristen-ahmad-alkhald-s-a-und-o-k,16,3273,"Behördliche Erfassung der Terroristen „Ahmad Alkhald“, S. A. und O. K.",minor,2018-02-23,Baden-Württemberg,AfD,Lars Patrick Berg,"Ministerium für Inneres, Digitalisierung und Migration"
2295,https://kleineanfragen.de/baden-wuerttemberg/16/3270-breitbandversorgung-im-kreis-freudenstadt,16,3270,Breitbandversorgung im Kreis Freudenstadt,minor,2018-02-23,Baden-Württemberg,AfD,Klaus Dürr,"Ministerium für Inneres, Digitalisierung und Migration"
2296,https://kleineanfragen.de/baden-wuerttemberg/16/3245-baulicher-zustand-der-hochschule-fuer-angewandte-wissenschaften-in-mannheim,16,3245,Baulicher Zustand der Hochschule für angewandte Wissenschaften in Mannheim,minor,2018-02-23,Baden-Württemberg,SPD,Stefan Fulst-Blei,Ministerium für Finanzen
2297,https://kleineanfragen.de/baden-wuerttemberg/16/3197-kriminalpraevention-und-wissenschaftlichkeit-aussagen-der-tuebinger-professorin-h,16,3197,Kriminalprävention und Wissenschaftlichkeit – Aussagen der Tübinger Professorin H.,minor,2018-02-23,Baden-Württemberg,AfD,Bernd Grimmer;Bernd Gögel,"Ministerium für Inneres, Digitalisierung und Migration"
2298,https://kleineanfragen.de/baden-wuerttemberg/16/3179-verkehrssituation-im-kirbachtal-im-landkreis-ludwigsburg,16,3179,Verkehrssituation im Kirbachtal im Landkreis Ludwigsburg,minor,2018-02-23,Baden-Württemberg,FDP/DVP,Jochen Haußmann,Ministerium für Verkehr
2299,https://kleineanfragen.de/baden-wuerttemberg/16/3402-schliessung-des-sozialwissenschaftlichen-informationsportals-sowiport-durch-das-leibniz-institut-fuer,16,3402,Schließung des sozialwissenschaftlichen Informationsportals Sowiport durch das Leibniz-Institut für Sozialwissenschaften GESIS,minor,2018-02-22,Baden-Württemberg,SPD,Ramazan Selcuk;Stefan Fulst-Blei;Boris Weirauch;Daniel Born,"Ministerium für Wissenschaft, Forschung und Kunst"
2300,https://kleineanfragen.de/baden-wuerttemberg/16/3275-stoerungen-auf-der-strecke-der-residenzbahn-und-der-intercity-2,16,3275,Störungen auf der Strecke der Residenzbahn und der Intercity 2,minor,2018-02-22,Baden-Württemberg,FDP/DVP,Erik Schweickert;Hans-Ulrich Rülke,Ministerium für Verkehr
2301,https://kleineanfragen.de/baden-wuerttemberg/16/3271-aufgaben-von-welcome-centern-rueckwerbung-deutscher-fachkraefte,16,3271,Aufgaben von Welcome Centern − Rückwerbung deutscher Fachkräfte,minor,2018-02-22,Baden-Württemberg,AfD,Lars Patrick Berg,"Ministerium für Wirtschaft, Arbeit und Wohnungsbau"
2302,https://kleineanfragen.de/baden-wuerttemberg/16/3266-stationspreise-in-bezug-auf-barrierefreiheit,16,3266,Stationspreise in Bezug auf Barrierefreiheit,minor,2018-02-22,Baden-Württemberg,FDP/DVP,Erik Schweickert,Ministerium für Verkehr
2303,https://kleineanfragen.de/baden-wuerttemberg/16/3257-vereine-und-eu-datenschutz-grundverordnung-eu-dsgvo,16,3257,Vereine und EU-Datenschutz-Grundverordnung (EU-DSGVO),minor,2018-02-22,Baden-Württemberg,FDP/DVP,Erik Schweickert,"Ministerium für Inneres, Digitalisierung und Migration"
2304,https://kleineanfragen.de/baden-wuerttemberg/16/3267-trassenpreise-in-bezug-auf-barrierefreiheit,16,3267,Trassenpreise in Bezug auf Barrierefreiheit,minor,2018-02-21,Baden-Württemberg,FDP/DVP,Erik Schweickert,Ministerium für Verkehr
2305,https://kleineanfragen.de/baden-wuerttemberg/16/3262-tagungen-der-parteien-cdu-fdp-gruene-und-csu-in-der-landesvertretung-baden-wuerttemberg-in-berlin-zur-bildung-einer,16,3262,"Tagungen der Parteien CDU, FDP, GRÜNE und CSU in der Landesvertretung Baden-Württemberg in Berlin zur Bildung einer Bundesregierung",minor,2018-02-21,Baden-Württemberg,SPD,Sascha Binder,Staatsministerium
2306,https://kleineanfragen.de/baden-wuerttemberg/16/3259-unterrichtsversorgung-an-grundschulen-in-mannheim,16,3259,Unterrichtsversorgung an Grundschulen in Mannheim,minor,2018-02-21,Baden-Württemberg,SPD,Stefan Fulst-Blei,"Ministerium für Kultus, Jugend und Sport"
2307,https://kleineanfragen.de/baden-wuerttemberg/16/3255-kaminbraende-in-schnellrestaurants-mit-grillanlagen,16,3255,Kaminbrände in Schnellrestaurants mit Grillanlagen,minor,2018-02-21,Baden-Württemberg,FDP/DVP,Erik Schweickert,"Ministerium für Inneres, Digitalisierung und Migration"
2308,https://kleineanfragen.de/baden-wuerttemberg/16/3274-wildbrethygiene-und-wildbretvermarktung-im-staatsforst-im-regierungsbezirk-karlsruhe,16,3274,Wildbrethygiene und Wildbretvermarktung im Staatsforst im Regierungsbezirk Karlsruhe,minor,2018-02-19,Baden-Württemberg,FDP/DVP,Erik Schweickert;Hans-Ulrich Rülke,Ministerium für Ländlichen Raum und Verbraucherschutz
2309,https://kleineanfragen.de/baden-wuerttemberg/16/3265-kuenftige-nutzung-von-schloss-kaltenstein,16,3265,Künftige Nutzung von Schloss Kaltenstein,minor,2018-02-19,Baden-Württemberg,FDP/DVP,Gerhard Aden,Ministerium für Finanzen
2310,https://kleineanfragen.de/baden-wuerttemberg/16/3239-nachfragen-zur-antwort-auf-die-kleine-anfrage-drucksache-16-2927-zu-polizeibeamten-ohne-deutsche,16,3239,Nachfragen zur Antwort auf die Kleine Anfrage Drucksache 16/2927 zu Polizeibeamten ohne deutsche Staatsbürgerschaft vom 27. Oktober 2017,minor,2018-02-19,Baden-Württemberg,fraktionslos,Wolfgang Gedeon,"Ministerium für Inneres, Digitalisierung und Migration"
2311,https://kleineanfragen.de/baden-wuerttemberg/16/3235-oekologische-vergabebuerokratie,16,3235,Ökologische Vergabebürokratie,minor,2018-02-19,Baden-Württemberg,FDP/DVP,Gabriele Reich-Gutjahr,"Ministerium für Finanzen;Ministerium für Inneres, Digitalisierung und Migration;Ministerium für Umwelt, Klima und Energiewirtschaft;Ministerium für Wirtschaft, Arbeit und Wohnungsbau"
2312,https://kleineanfragen.de/baden-wuerttemberg/16/3220-zuverlaessigkeit-des-schienenpersonennahverkehrs-im-landkreis-ludwigsburg,16,3220,Zuverlässigkeit des Schienenpersonennahverkehrs im Landkreis Ludwigsburg,minor,2018-02-19,Baden-Württemberg,CDU,Fabian Gramling;Konrad Epple,Ministerium für Verkehr
2313,https://kleineanfragen.de/baden-wuerttemberg/16/3157-ausbau-der-kleinen-wasserkraft-und-fischerei,16,3157,Ausbau der kleinen Wasserkraft und Fischerei,minor,2018-02-19,Baden-Württemberg,CDU,Sylvia Felder,"Ministerium für Umwelt, Klima und Energiewirtschaft"
2314,https://kleineanfragen.de/baden-wuerttemberg/16/3135-donauwehr-tuttlingen,16,3135,Donauwehr Tuttlingen,minor,2018-02-19,Baden-Württemberg,CDU,Guido Wolf,"Ministerium für Umwelt, Klima und Energiewirtschaft"
2315,https://kleineanfragen.de/baden-wuerttemberg/16/3242-feinstaubbelastung-durch-schienenfahrzeuge,16,3242,Feinstaubbelastung durch Schienenfahrzeuge,minor,2018-02-16,Baden-Württemberg,CDU,Fabian Gramling,"Ministerium für Wirtschaft, Arbeit und Wohnungsbau;Ministerium für Verkehr"
2316,https://kleineanfragen.de/baden-wuerttemberg/16/3238-aenderung-der-polizeifarbe,16,3238,Änderung der Polizeifarbe,minor,2018-02-16,Baden-Württemberg,fraktionslos,Wolfgang Gedeon,"Ministerium für Inneres, Digitalisierung und Migration"
2317,https://kleineanfragen.de/baden-wuerttemberg/16/3232-ausbau-bundesstrasse-b-35,16,3232,Ausbau Bundesstraße (B) 35,minor,2018-02-16,Baden-Württemberg,FDP/DVP,Erik Schweickert,Ministerium für Verkehr
2318,https://kleineanfragen.de/baden-wuerttemberg/16/3246-auswirkungen-der-studiengebuehren-fuer-nicht-eu-auslaender-auf-den-hochschulstandort-mannheim,16,3246,Auswirkungen der Studiengebühren für Nicht-EU-Ausländer auf den Hochschulstandort Mannheim,minor,2018-02-15,Baden-Württemberg,SPD,Stefan Fulst-Blei,"Ministerium für Wissenschaft, Forschung und Kunst"
2319,https://kleineanfragen.de/baden-wuerttemberg/16/3240-situation-der-tagesmuetter-und-vaeter-im-wahlkreis-konstanz,16,3240,Situation der Tagesmütter und -väter im Wahlkreis Konstanz,minor,2018-02-15,Baden-Württemberg,Die Grünen,Nese Erikli,"Ministerium für Kultus, Jugend und Sport"
2320,https://kleineanfragen.de/baden-wuerttemberg/16/3237-erzwungene-teilnahme-im-koedukativen-sportunterricht,16,3237,Erzwungene Teilnahme im koedukativen Sportunterricht,minor,2018-02-15,Baden-Württemberg,fraktionslos,Wolfgang Gedeon,"Ministerium für Kultus, Jugend und Sport"
2321,https://kleineanfragen.de/baden-wuerttemberg/16/3129-strassen-und-brueckenbauwerke-im-landkreis-schwaebisch-hall,16,3129,Straßen und Brückenbauwerke im Landkreis Schwäbisch Hall,minor,2018-02-15,Baden-Württemberg,FDP/DVP,Dr. Friedrich Bullinger,Ministerium für Verkehr
2322,https://kleineanfragen.de/baden-wuerttemberg/16/3243-hochwasserschutz-im-kreis-freudenstadt,16,3243,Hochwasserschutz im Kreis Freudenstadt,minor,2018-02-14,Baden-Württemberg,AfD,Klaus Dürr,"Ministerium für Inneres, Digitalisierung und Migration;Ministerium für Umwelt, Klima und Energiewirtschaft"
2323,https://kleineanfragen.de/baden-wuerttemberg/16/3233-fahrgastbefragungen-im-enzkreis,16,3233,Fahrgastbefragungen im Enzkreis,minor,2018-02-14,Baden-Württemberg,FDP/DVP,Erik Schweickert,Ministerium für Verkehr
2324,https://kleineanfragen.de/baden-wuerttemberg/16/3177-verspaetungen-und-zugausfaelle-auf-der-neckartalbahn,16,3177,Verspätungen und Zugausfälle auf der Neckartalbahn,minor,2018-02-14,Baden-Württemberg,SPD,Ramazan Selcuk,Ministerium für Verkehr
2325,https://kleineanfragen.de/baden-wuerttemberg/16/3167-finanzierung-der-schoenbuchbahn-durch-das-land,16,3167,Finanzierung der Schönbuchbahn durch das Land,minor,2018-02-14,Baden-Württemberg,CDU,Paul Nemeth,Ministerium für Verkehr
2326,https://kleineanfragen.de/baden-wuerttemberg/16/3130-barrierefreiheit-an-bahnhoefen-im-landkreis-schwaebisch-hall,16,3130,Barrierefreiheit an Bahnhöfen im Landkreis Schwäbisch Hall,minor,2018-02-14,Baden-Württemberg,FDP/DVP,Dr. Friedrich Bullinger,Ministerium für Verkehr
2327,https://kleineanfragen.de/baden-wuerttemberg/16/3084-verursachte-emissionen-und-umweltbelastungen-durch-die-nutzung-von-flugzeugen-durch-mitglieder-der-landesregierung,16,3084,Verursachte Emissionen und Umweltbelastungen durch die Nutzung von Flugzeugen durch Mitglieder der Landesregierung in der 15. Legislaturperiode,minor,2018-02-14,Baden-Württemberg,FDP/DVP,Dr. Friedrich Bullinger,Ministerium für Finanzen
2328,https://kleineanfragen.de/baden-wuerttemberg/16/3038-qualitaets-check-der-baden-wuerttembergischen-naturschutz-organisationen-landesnaturschutzverband-baden,16,3038,"Qualitäts-Check der baden-württembergischen Naturschutz-Organisationen Landesnaturschutzverband Baden-Württemberg e. V. (LNV), Bund für Umwelt und Naturschutz Deutschland (BUND) und Naturschutzbund Deutschland (NABU) über Artenschutzgutachten von Windkraft-Genehmigungen",major,2018-02-14,Baden-Württemberg,AfD,,Landesregierung
2329,https://kleineanfragen.de/baden-wuerttemberg/16/3168-radschnellverbindung-boeblingen-sindelfingen-stuttgart,16,3168,Radschnellverbindung Böblingen/Sindelfingen−Stuttgart,minor,2018-02-13,Baden-Württemberg,CDU,Paul Nemeth,Ministerium für Ländlichen Raum und Verbraucherschutz;Ministerium für Verkehr
2330,https://kleineanfragen.de/baden-wuerttemberg/16/3137-strassen-und-brueckenbauwerke-im-landkreis-konstanz,16,3137,Straßen und Brückenbauwerke im Landkreis Konstanz,minor,2018-02-13,Baden-Württemberg,FDP/DVP,Jürgen Keck,Ministerium für Verkehr
2331,https://kleineanfragen.de/baden-wuerttemberg/16/3224-wildunfaelle-und-wildschaeden,16,3224,Wildunfälle und Wildschäden,minor,2018-02-09,Baden-Württemberg,Die Grünen,Bettina Lisbach;Markus Rösler,"Ministerium für Inneres, Digitalisierung und Migration"
2332,https://kleineanfragen.de/baden-wuerttemberg/16/3141-jugendgemeinderaete-in-baden-wuerttemberg,16,3141,Jugendgemeinderäte in Baden-Württemberg,minor,2018-02-09,Baden-Württemberg,CDU,Christine Neumann;Sylvia Felder,"Ministerium für Inneres, Digitalisierung und Migration"
2333,https://kleineanfragen.de/baden-wuerttemberg/16/3234-lehrerversorgung-in-der-stadt-pforzheim-und-dem-enzkreis-im-schuljahr-2017-18,16,3234,Lehrerversorgung in der Stadt Pforzheim und dem Enzkreis im Schuljahr 2017/18,minor,2018-02-08,Baden-Württemberg,FDP/DVP,Erik Schweickert;Hans-Ulrich Rülke,"Ministerium für Kultus, Jugend und Sport"
2334,https://kleineanfragen.de/baden-wuerttemberg/16/3199-sachstand-auskreisung-reutlingen-und-kreiswechsel-bad-herrenalb,16,3199,Sachstand Auskreisung Reutlingen und Kreiswechsel Bad Herrenalb,minor,2018-02-08,Baden-Württemberg,AfD,Rainer Balzer;Klaus Dürr,"Ministerium für Inneres, Digitalisierung und Migration"
2335,https://kleineanfragen.de/baden-wuerttemberg/16/3198-rolle-rueckwaerts-bei-der-umweltzone-in-balingen,16,3198,Rolle rückwärts bei der Umweltzone in Balingen?,minor,2018-02-08,Baden-Württemberg,AfD,Stefan Herre,Ministerium für Verkehr
2336,https://kleineanfragen.de/baden-wuerttemberg/16/3152-untersuchungsausschuss-das-unterstuetzerumfeld-des-nationalsozialistischen-untergrunds-nsu-in-baden-wuerttemberg,16,3152,Untersuchungsausschuss „Das Unterstützerumfeld des Nationalsozialistischen Untergrunds (NSU) in Baden-Württemberg und Fortsetzung der Aufarbeitung des Terroranschlags auf die Polizeibeamten M. K. und M. A. (Rechtsterrorismus/NSU BW II)“ – Observationen des Landeskriminalamts Baden-Württemberg,minor,2018-02-08,Baden-Württemberg,AfD,Hans Peter Stauch;Christina Baum,"Ministerium für Inneres, Digitalisierung und Migration"
2337,https://kleineanfragen.de/baden-wuerttemberg/16/3190-verspaetungen-zugausfaelle-und-befoerderungskapazitaeten-auf-der-bodensee-guertelbahn-strecke-radolfzell,16,3190,"Verspätungen, Zugausfälle und Beförderungskapazitäten auf der Bodensee-Gürtelbahn (Strecke Radolfzell−Friedrichshafen)",minor,2018-02-07,Baden-Württemberg,FDP/DVP,Jürgen Keck,Ministerium für Verkehr
2338,https://kleineanfragen.de/baden-wuerttemberg/16/3178-sanierung-der-autobahnbruecke-a-81-bei-eberstadt-hoelzern,16,3178,Sanierung der Autobahnbrücke A 81 bei Eberstadt-Hölzern,minor,2018-02-07,Baden-Württemberg,SPD,Reinhold Gall,Ministerium für Verkehr
2339,https://kleineanfragen.de/baden-wuerttemberg/16/3153-untersuchungsausschuss-das-unterstuetzerumfeld-des-nationalsozialistischen-untergrunds-nsu-in-baden-wuerttemberg,16,3153,Untersuchungsausschuss „Das Unterstützerumfeld des Nationalsozialistischen Untergrunds (NSU) in Baden-Württemberg und Fortsetzung der Aufarbeitung des Terroranschlags auf die Polizeibeamten M. K. und M. A. (Rechtsterrorismus/NSU BW II)“ – Anwerbung und Observationen des Landesamts für Verfassungsschutz,minor,2018-02-07,Baden-Württemberg,AfD,Hans Peter Stauch;Christina Baum,"Ministerium für Inneres, Digitalisierung und Migration"
2340,https://kleineanfragen.de/baden-wuerttemberg/16/3192-welche-funktion-hat-der-pressereferent-des-innenministers-als-mitglied-in-dem-vom-integrationsminister-geleiteten,16,3192,Welche Funktion hat der Pressereferent des Innenministers als Mitglied in dem vom Integrationsminister geleiteten Landesbeirat für Integration?,minor,2018-02-05,Baden-Württemberg,SPD,Sabine Wölfle,"Ministerium für Arbeit und Sozialordnung, Familie, Frauen und Senioren;Ministerium für Inneres, Digitalisierung und Migration;Ministerium für Soziales und Integration"
2341,https://kleineanfragen.de/baden-wuerttemberg/16/3142-struktur-und-zukunft-des-gastronomiegewerbes-im-landkreis-biberach,16,3142,Struktur und Zukunft des Gastronomiegewerbes im Landkreis Biberach,minor,2018-02-05,Baden-Württemberg,CDU,Thomas Dörflinger,"Ministerium der Justiz und für Europa;Ministerium für Ländlichen Raum und Verbraucherschutz;Ministerium für Wirtschaft, Arbeit und Wohnungsbau"
2342,https://kleineanfragen.de/baden-wuerttemberg/16/3136-erdhebungen-durch-geothermiebohrungen-insbesondere-in-boeblingen,16,3136,Erdhebungen durch Geothermiebohrungen insbesondere in Böblingen,minor,2018-02-02,Baden-Württemberg,CDU,Paul Nemeth,"Ministerium für Finanzen;Ministerium für Umwelt, Klima und Energiewirtschaft"
2343,https://kleineanfragen.de/baden-wuerttemberg/16/3116-geschaeftsaufgaben-von-gastwirtschaften,16,3116,Geschäftsaufgaben von Gastwirtschaften,minor,2018-02-02,Baden-Württemberg,AfD,Christina Baum,"Ministerium der Justiz und für Europa;Ministerium für Ländlichen Raum und Verbraucherschutz;Ministerium für Wirtschaft, Arbeit und Wohnungsbau"
2344,https://kleineanfragen.de/baden-wuerttemberg/16/3144-arbeitsbedingungen-der-beschaeftigten-am-universitaetsklinikum-heidelberg,16,3144,Arbeitsbedingungen der Beschäftigten am Universitätsklinikum Heidelberg,minor,2018-02-01,Baden-Württemberg,SPD,Gerhard Kleinböck,"Ministerium für Wissenschaft, Forschung und Kunst"
