,html_url,legislative_term,reference,title,interpellation_type,published_at,body,inquiring_parties_wikidata,inquiring_people_wikidata,answering_ministries_wikidata
2894,https://kleineanfragen.de/baden-wuerttemberg/16/1711-laermaktionsplaene,16,1711,Lärmaktionspläne,minor,2017-05-04,Baden-Württemberg,CDU,Marion Gentges,Ministerium für Verkehr
2895,https://kleineanfragen.de/baden-wuerttemberg/16/1490-situation-der-pflegeeinrichtungen-und-ambulant-betreuter-wohngruppen-im-landkreis-konstanz,16,1490,Situation der Pflegeeinrichtungen und ambulant betreuter Wohngruppen im Landkreis Konstanz,minor,2017-05-04,Baden-Württemberg,Die Grünen,Dorothea Wehinger,"Ministerium für Soziales und Integration;Ministerium für Arbeit und Sozialordnung, Familie, Frauen und Senioren"
2896,https://kleineanfragen.de/baden-wuerttemberg/16/1734-weitere-nachfragen-zur-drucksache-16-1168,16,1734,Weitere Nachfragen zur Drucksache 16/1168,minor,2017-05-03,Baden-Württemberg,FDP/DVP,Andreas Glück,"Ministerium für Umwelt, Klima und Energiewirtschaft"
2897,https://kleineanfragen.de/baden-wuerttemberg/16/1732-verbraucherschutz-bei-holzbauten,16,1732,Verbraucherschutz bei Holzbauten,minor,2017-05-03,Baden-Württemberg,FDP/DVP,Dr. Friedrich Bullinger,"Ministerium für Ländlichen Raum und Verbraucherschutz;Ministerium für Finanzen;Ministerium für Umwelt, Klima und Energiewirtschaft;Ministerium für Wirtschaft, Arbeit und Wohnungsbau"
2898,https://kleineanfragen.de/baden-wuerttemberg/16/1731-schuelerbefoerderung-im-noerdlichen-enzkreis,16,1731,Schülerbeförderung im nördlichen Enzkreis,minor,2017-05-03,Baden-Württemberg,FDP/DVP,Erik Schweickert,"Ministerium für Kultus, Jugend und Sport"
2899,https://kleineanfragen.de/baden-wuerttemberg/16/1729-zustand-und-sanierung-der-landesstrasse-l-1134-zwischen-maulbronn-zaisersweiher-und-muehlacker-lienzingen,16,1729,Zustand und Sanierung der Landesstraße (L) 1134 zwischen Maulbronn-Zaisersweiher und Mühlacker-Lienzingen,minor,2017-05-03,Baden-Württemberg,FDP/DVP,Erik Schweickert,Ministerium für Verkehr
2900,https://kleineanfragen.de/baden-wuerttemberg/16/1728-vakante-schulleiterstellen-im-enzkreis-und-in-pforzheim,16,1728,Vakante Schulleiterstellen im Enzkreis und in Pforzheim,minor,2017-05-03,Baden-Württemberg,Die Grünen,Stefanie Seemann,"Ministerium für Kultus, Jugend und Sport"
2901,https://kleineanfragen.de/baden-wuerttemberg/16/1722-mobilitaetskonzept-stadt-stuttgart,16,1722,Mobilitätskonzept Stadt Stuttgart,minor,2017-05-03,Baden-Württemberg,FDP/DVP,Gabriele Reich-Gutjahr,Ministerium für Verkehr
2902,https://kleineanfragen.de/baden-wuerttemberg/16/1721-neutralitaetspflicht-von-amtstraegern-in-wahlkaempfen,16,1721,Neutralitätspflicht von Amtsträgern in Wahlkämpfen,minor,2017-05-03,Baden-Württemberg,FDP/DVP,Hans-Ulrich Rülke,"Ministerium für Inneres, Digitalisierung und Migration"
2903,https://kleineanfragen.de/baden-wuerttemberg/16/1720-auswirkungen-der-baustellen-im-stadtgebiet-von-stuttgart-auf-die-feinstaubbelastung,16,1720,Auswirkungen der Baustellen im Stadtgebiet von Stuttgart auf die Feinstaubbelastung,minor,2017-05-03,Baden-Württemberg,CDU,Andreas Deuschle,"Ministerium für Wirtschaft, Arbeit und Wohnungsbau;Ministerium für Verkehr"
2904,https://kleineanfragen.de/baden-wuerttemberg/16/1717-kinder-und-familienzentren-im-landkreis-konstanz,16,1717,Kinder- und Familienzentren im Landkreis Konstanz,minor,2017-04-27,Baden-Württemberg,Die Grünen,Dorothea Wehinger,"Ministerium für Kultus, Jugend und Sport"
2905,https://kleineanfragen.de/baden-wuerttemberg/16/1715-flugverkehr-ueber-dem-windvorranggebiet-bb-02,16,1715,Flugverkehr über dem Windvorranggebiet BB-02,minor,2017-04-27,Baden-Württemberg,FDP/DVP,Erik Schweickert,"Ministerium für Wirtschaft, Arbeit und Wohnungsbau"
2906,https://kleineanfragen.de/baden-wuerttemberg/16/1699-mobilitaetsfoerderprogramm-drive-im-hohenloheund-main-tauber-kreis,16,1699,Mobilitätsförderprogramm „Drive“ im Hohenloheund Main-Tauber-Kreis,minor,2017-04-27,Baden-Württemberg,AfD,Christina Baum;Anton Baron,"Ministerium für Inneres, Digitalisierung und Migration"
2907,https://kleineanfragen.de/baden-wuerttemberg/16/1696-entwicklung-der-umweltzonen-im-regierungsbezirk-freiburg-und-auswirkungen-der-geplanten-fahrverbote-auf-weitere,16,1696,Entwicklung der Umweltzonen im Regierungsbezirk Freiburg und Auswirkungen der geplanten Fahrverbote auf weitere Umweltzonen,minor,2017-04-27,Baden-Württemberg,FDP/DVP,Gerhard Aden,"Ministerium für Wirtschaft, Arbeit und Wohnungsbau;Ministerium für Verkehr"
2908,https://kleineanfragen.de/baden-wuerttemberg/16/1527-zuverlaessigkeit-des-bahnverkehrs-im-netz-7-a-b-stadtbahn-karlsruhe-entlang-der-strecke-buehl-karlsruhe,16,1527,Zuverlässigkeit des Bahnverkehrs im Netz 7 a/b „Stadtbahn Karlsruhe“ entlang der Strecke Bühl−Karlsruhe,minor,2017-04-27,Baden-Württemberg,CDU,Tobias Wald,Ministerium für Verkehr
2909,https://kleineanfragen.de/baden-wuerttemberg/16/1712-musikunterricht-an-der-grundschule-und-ausbildung-der-musiklehrerinnen-und-lehrer,16,1712,Musikunterricht an der Grundschule und Ausbildung der Musiklehrerinnen und -lehrer,minor,2017-04-26,Baden-Württemberg,Die Grünen,Sandra Boser,"Ministerium für Wissenschaft, Forschung und Kunst;Ministerium für Kultus, Jugend und Sport"
2910,https://kleineanfragen.de/baden-wuerttemberg/16/1703-schulbesuchsverordnung-in-zeiten-der-ganztagsschule,16,1703,Schulbesuchsverordnung in Zeiten der Ganztagsschule,minor,2017-04-26,Baden-Württemberg,FDP/DVP,Erik Schweickert,"Ministerium für Kultus, Jugend und Sport"
2911,https://kleineanfragen.de/baden-wuerttemberg/16/1702-zustand-der-landesstrasse-l-1001,16,1702,Zustand der Landesstraße L 1001,minor,2017-04-26,Baden-Württemberg,AfD,Christina Baum,Ministerium für Verkehr
2912,https://kleineanfragen.de/baden-wuerttemberg/16/1700-buergermeister-und-gemeinderaete-in-baden-wuerttemberg,16,1700,Bürgermeister und Gemeinderäte in Baden-Württemberg,minor,2017-04-26,Baden-Württemberg,AfD,Thomas Axel Palka,"Ministerium für Inneres, Digitalisierung und Migration"
2913,https://kleineanfragen.de/baden-wuerttemberg/16/1698-strassenzustand-der-landesstrassen-l-1048-und-l-1046-im-hohenlohekreis,16,1698,Straßenzustand der Landesstraßen L 1048 und L 1046 im Hohenlohekreis,minor,2017-04-26,Baden-Württemberg,AfD,Anton Baron,Ministerium für Verkehr
2914,https://kleineanfragen.de/baden-wuerttemberg/16/1697-muellgebuehren-im-hohenlohekreis,16,1697,Müllgebühren im Hohenlohekreis,minor,2017-04-24,Baden-Württemberg,AfD,Anton Baron,"Ministerium für Inneres, Digitalisierung und Migration;Ministerium für Umwelt, Klima und Energiewirtschaft"
2915,https://kleineanfragen.de/baden-wuerttemberg/16/1693-auswirkungen-des-vom-kabinett-beschlossenen-gesamtkonzepts-fuer-die-3-fortschreibung-des-luftreinhalteplans,16,1693,Auswirkungen des vom Kabinett beschlossenen Gesamtkonzepts für die 3. Fortschreibung des Luftreinhalteplans Stuttgart auf den Landkreis Esslingen,minor,2017-04-24,Baden-Württemberg,CDU,Andreas Deuschle,"Ministerium für Wirtschaft, Arbeit und Wohnungsbau;Ministerium für Verkehr"
2916,https://kleineanfragen.de/baden-wuerttemberg/16/1691-laermschutz-im-zuge-des-ausbaus-der-bundesautobahn-8-a-8-im-bereich-der-gemeinde-remchingen,16,1691,Lärmschutz im Zuge des Ausbaus der Bundesautobahn 8 (A 8) im Bereich der Gemeinde Remchingen,minor,2017-04-24,Baden-Württemberg,FDP/DVP,Erik Schweickert,Ministerium für Verkehr
2917,https://kleineanfragen.de/baden-wuerttemberg/16/1678-situation-nach-der-buergermeisterwahl-in-eppelheim,16,1678,Situation nach der Bürgermeisterwahl in Eppelheim,minor,2017-04-24,Baden-Württemberg,SPD,Daniel Born,"Ministerium für Inneres, Digitalisierung und Migration"
2918,https://kleineanfragen.de/baden-wuerttemberg/16/1667-anzahl-der-erwerbslosen-in-baden-wuerttemberg-im-januar-2017,16,1667,Anzahl der Erwerbslosen in Baden-Württemberg im Januar 2017,minor,2017-04-24,Baden-Württemberg,AfD,Udo Stein,"Ministerium für Wirtschaft, Arbeit und Wohnungsbau"
2919,https://kleineanfragen.de/baden-wuerttemberg/16/1640-projektkoordination-waehrend-des-ausbaus-der-enztalquerung,16,1640,Projektkoordination während des Ausbaus der Enztalquerung,minor,2017-04-24,Baden-Württemberg,FDP/DVP,Erik Schweickert,Ministerium für Verkehr
2920,https://kleineanfragen.de/baden-wuerttemberg/16/1689-aerztliche-und-pflegerische-versorgung-in-den-landkreisen-tuttlingen-und-schwarzwald-baar,16,1689,Ärztliche und pflegerische Versorgung in den Landkreisen Tuttlingen und Schwarzwald-Baar,minor,2017-04-21,Baden-Württemberg,AfD,Lars Patrick Berg,"Ministerium für Arbeit und Sozialordnung, Familie, Frauen und Senioren;Ministerium für Soziales und Integration"
2921,https://kleineanfragen.de/baden-wuerttemberg/16/1677-radverkehrsfoerderung-im-enzkreis,16,1677,Radverkehrsförderung im Enzkreis,minor,2017-04-21,Baden-Württemberg,Die Grünen,Stefanie Seemann,Ministerium für Verkehr
2922,https://kleineanfragen.de/baden-wuerttemberg/16/1672-barrierefreiheit-im-oeffentlichen-personennahverkehr-oepnv-im-landkreis-konstanz,16,1672,Barrierefreiheit im öffentlichen Personennahverkehr (ÖPNV) im Landkreis Konstanz,minor,2017-04-21,Baden-Württemberg,FDP/DVP,Jürgen Keck,Ministerium für Verkehr
2923,https://kleineanfragen.de/baden-wuerttemberg/16/1668-ueberblick-ueber-den-aufwand-an-polizeipersonal-und-die-kosten-fuer-parteitage-im-jahr-2016,16,1668,Überblick über den Aufwand an Polizeipersonal und die Kosten für Parteitage im Jahr 2016,minor,2017-04-21,Baden-Württemberg,AfD,Daniel Rottmann;Udo Stein,"Ministerium für Inneres, Digitalisierung und Migration"
2924,https://kleineanfragen.de/baden-wuerttemberg/16/1608-zur-lobbyarbeit-von-solar-cluster-baden-wuerttemberg-e-v,16,1608,Zur Lobbyarbeit von Solar-Cluster Baden-Württemberg e. V.,minor,2017-04-21,Baden-Württemberg,CDU,Paul Nemeth,"Ministerium für Umwelt, Klima und Energiewirtschaft"
2925,https://kleineanfragen.de/baden-wuerttemberg/16/1675-bahnsteighoehen-entlang-der-residenzbahn,16,1675,Bahnsteighöhen entlang der Residenzbahn,minor,2017-04-20,Baden-Württemberg,FDP/DVP,Erik Schweickert,Ministerium für Verkehr
2926,https://kleineanfragen.de/baden-wuerttemberg/16/1664-verspaetungen-und-zugausfaelle-auf-der-bodensee-guertelbahn-strecke-radolfzell-friedrichshafen,16,1664,Verspätungen und Zugausfälle auf der Bodensee-Gürtelbahn (Strecke Radolfzell-Friedrichshafen),minor,2017-04-20,Baden-Württemberg,FDP/DVP,Klaus Hoher,Ministerium für Verkehr
2927,https://kleineanfragen.de/baden-wuerttemberg/16/1663-auswirkungen-der-pfarrplaene-2018-und-2024-der-evangelischen-landeskirche-wuerttemberg,16,1663,Auswirkungen der Pfarrpläne 2018 und 2024 der Evangelischen Landeskirche Württemberg,minor,2017-04-20,Baden-Württemberg,FDP/DVP,Dr. Friedrich Bullinger,"Ministerium für Finanzen;Ministerium für Kultus, Jugend und Sport"
2928,https://kleineanfragen.de/baden-wuerttemberg/16/1659-bauvorhaben-fuer-geplante-strassenbahnhaltestellen,16,1659,Bauvorhaben für geplante Straßenbahnhaltestellen,minor,2017-04-20,Baden-Württemberg,FDP/DVP,Hans-Ulrich Rülke,Ministerium für Verkehr
2929,https://kleineanfragen.de/baden-wuerttemberg/16/1519-umweltbelastungen-durch-den-truppenuebungsplatz-heuberg-im-zollernalbkreis-sowie-alle-weiteren-noch-genutzten-in,16,1519,Umweltbelastungen durch den Truppenübungsplatz Heuberg im Zollernalbkreis sowie alle weiteren noch genutzten in Baden-Württemberg,minor,2017-04-20,Baden-Württemberg,AfD,Stefan Herre,"Ministerium für Wirtschaft, Arbeit und Wohnungsbau;Ministerium für Ländlichen Raum und Verbraucherschutz;Ministerium für Finanzen;Ministerium für Umwelt, Klima und Energiewirtschaft"
2930,https://kleineanfragen.de/baden-wuerttemberg/16/1343-pflegesituation-und-situation-der-pflegereinrichtungen-im-wahlkreis-ettlingen-und-im-landkreis-karlsruhe,16,1343,Pflegesituation und Situation der Pflegereinrichtungen im Wahlkreis Ettlingen und im Landkreis Karlsruhe,minor,2017-04-20,Baden-Württemberg,CDU,Christine Neumann,"Ministerium für Arbeit und Sozialordnung, Familie, Frauen und Senioren;Ministerium für Soziales und Integration"
2931,https://kleineanfragen.de/baden-wuerttemberg/16/1701-wildschaeden-im-zollernalbkreis,16,1701,Wildschäden im Zollernalbkreis,minor,2017-04-19,Baden-Württemberg,AfD,Stefan Herre,Ministerium für Ländlichen Raum und Verbraucherschutz
2932,https://kleineanfragen.de/baden-wuerttemberg/16/1665-foerderung-von-familien-in-islamischen-gemeinden-in-baden-wuerttemberg,16,1665,Förderung von Familien in islamischen Gemeinden in Baden-Württemberg,minor,2017-04-19,Baden-Württemberg,AfD,Christina Baum,"Ministerium für Arbeit und Sozialordnung, Familie, Frauen und Senioren;Ministerium für Soziales und Integration"
2933,https://kleineanfragen.de/baden-wuerttemberg/16/1662-bau-und-foerderung-von-ballsporthallen-ohne-und-mit-heizung-als-kostenguenstige-alternative-oder-ergaenzung-zu,16,1662,Bau und Förderung von Ballsporthallen ohne und mit Heizung als kostengünstige Alternative oder Ergänzung zu vorhandenen Sporthallen,minor,2017-04-19,Baden-Württemberg,FDP/DVP,Dr. Friedrich Bullinger,"Ministerium für Ländlichen Raum und Verbraucherschutz;Ministerium für Kultus, Jugend und Sport"
2934,https://kleineanfragen.de/baden-wuerttemberg/16/1681-verkauf-der-grundstuecke-der-ehemaligen-asbestverwertungsanlage-herrenteich-hockenheim,16,1681,Verkauf der Grundstücke der ehemaligen Asbestverwertungsanlage Herrenteich Hockenheim,minor,2017-04-18,Baden-Württemberg,SPD,Daniel Born,"Ministerium für Ländlichen Raum und Verbraucherschutz;Ministerium für Umwelt, Klima und Energiewirtschaft;Ministerium für Finanzen"
2935,https://kleineanfragen.de/baden-wuerttemberg/16/1679-der-wirtschaftsstandort-und-exportmotor-baden-wuerttemberg-vor-dem-hintergrund-der-neuen-herausforderungen-in-der,16,1679,Der Wirtschaftsstandort und Exportmotor Baden-Württemberg vor dem Hintergrund der neuen Herausforderungen in der Europapolitik,major,2017-04-18,Baden-Württemberg,FDP/DVP;SPD,,Landesregierung
2936,https://kleineanfragen.de/baden-wuerttemberg/16/1669-vorkommen-des-auerwilds-im-schwarzwald,16,1669,Vorkommen des Auerwilds im Schwarzwald,minor,2017-04-18,Baden-Württemberg,AfD,Udo Stein,"Ministerium für Ländlichen Raum und Verbraucherschutz;Ministerium für Umwelt, Klima und Energiewirtschaft"
2937,https://kleineanfragen.de/baden-wuerttemberg/16/1637-auswirkungen-von-biberpopulationen,16,1637,Auswirkungen von Biberpopulationen,minor,2017-04-18,Baden-Württemberg,CDU,Klaus Burger,"Ministerium für Umwelt, Klima und Energiewirtschaft"
2938,https://kleineanfragen.de/baden-wuerttemberg/16/1619-verlaessliche-zugausfaelle-auf-der-murrbahn-seit-der-fahrplanumstellung-im-herbst-2016,16,1619,Verlässliche Zugausfälle auf der Murrbahn seit der Fahrplanumstellung im Herbst 2016,minor,2017-04-18,Baden-Württemberg,FDP/DVP,Dr. Friedrich Bullinger,Ministerium für Verkehr
2939,https://kleineanfragen.de/baden-wuerttemberg/16/1622-geplantes-windenergie-repowering-auf-dem-rohrhardsberg,16,1622,Geplantes Windenergie-Repowering auf dem Rohrhardsberg,minor,2017-04-13,Baden-Württemberg,FDP/DVP,Andreas Glück,"Ministerium der Justiz und für Europa;Ministerium für Wirtschaft, Arbeit und Wohnungsbau;Ministerium für Ländlichen Raum und Verbraucherschutz;Ministerium für Umwelt, Klima und Energiewirtschaft"
2940,https://kleineanfragen.de/baden-wuerttemberg/16/1609-videoueberwachung-in-mannheim,16,1609,Videoüberwachung in Mannheim,minor,2017-04-13,Baden-Württemberg,SPD,Stefan Fulst-Blei;Boris Weirauch,"Ministerium für Inneres, Digitalisierung und Migration"
2941,https://kleineanfragen.de/baden-wuerttemberg/16/1604-suizide-in-der-justizvollzugsanstalt-heimsheim,16,1604,Suizide in der Justizvollzugsanstalt Heimsheim,minor,2017-04-13,Baden-Württemberg,FDP/DVP,Erik Schweickert,Ministerium der Justiz und für Europa
2942,https://kleineanfragen.de/baden-wuerttemberg/16/1602-situation-der-polizei-im-landkreis-sigmaringen,16,1602,Situation der Polizei im Landkreis Sigmaringen,minor,2017-04-13,Baden-Württemberg,Die Grünen,Andrea Bogner-Unden,"Ministerium für Inneres, Digitalisierung und Migration"
2943,https://kleineanfragen.de/baden-wuerttemberg/16/1600-regionale-auswirkungen-des-niedrigwassers-der-murr,16,1600,Regionale Auswirkungen des Niedrigwassers der Murr,minor,2017-04-13,Baden-Württemberg,SPD,Gernot Gruber,"Ministerium für Ländlichen Raum und Verbraucherschutz;Ministerium für Umwelt, Klima und Energiewirtschaft"
2944,https://kleineanfragen.de/baden-wuerttemberg/16/1560-situation-von-fachlehrerinnen-und-fachlehrern-im-bereich-sport-an-grundschulen,16,1560,Situation von Fachlehrerinnen und Fachlehrern im Bereich Sport an Grundschulen,minor,2017-04-13,Baden-Württemberg,Die Grünen,Petra Häffner,"Ministerium für Kultus, Jugend und Sport"
2945,https://kleineanfragen.de/baden-wuerttemberg/16/1459-weitere-massnahmen-gegen-den-links-und-rechtsextremismus,16,1459,Weitere Maßnahmen gegen den Links- und Rechtsextremismus,minor,2017-04-13,Baden-Württemberg,AfD,Carola Wolle;Rainer Podeswa;Thomas Axel Palka,"Ministerium für Inneres, Digitalisierung und Migration"
2946,https://kleineanfragen.de/baden-wuerttemberg/16/1618-foerderung-und-unterstuetzung-von-existenzgruendungen-in-der-region-heilbronn-franken,16,1618,Förderung und Unterstützung von Existenzgründungen in der Region Heilbronn-Franken,minor,2017-04-12,Baden-Württemberg,FDP/DVP,Dr. Friedrich Bullinger;Nico Weinmann,"Ministerium für Wirtschaft, Arbeit und Wohnungsbau"
2947,https://kleineanfragen.de/baden-wuerttemberg/16/1603-pruefpflicht-fuer-private-abwasseranlagen-in-wasserschutzgebieten-im-enzkreis,16,1603,Prüfpflicht für private Abwasseranlagen in Wasserschutzgebieten im Enzkreis,minor,2017-04-12,Baden-Württemberg,FDP/DVP,Erik Schweickert,"Ministerium für Umwelt, Klima und Energiewirtschaft"
2948,https://kleineanfragen.de/baden-wuerttemberg/16/1521-unterrichtsversorgung-an-den-schulen-im-regierungsbezirk-tuebingen,16,1521,Unterrichtsversorgung an den Schulen im Regierungsbezirk Tübingen,minor,2017-04-12,Baden-Württemberg,AfD,Stefan Herre,"Ministerium für Kultus, Jugend und Sport"
2949,https://kleineanfragen.de/baden-wuerttemberg/16/1390-situation-der-justizvollzugsanstalten-in-baden-wuerttemberg,16,1390,Situation der Justizvollzugsanstalten in Baden-Württemberg,minor,2017-04-12,Baden-Württemberg,AfD,Stefan Herre,Ministerium für Finanzen;Ministerium der Justiz und für Europa
2950,https://kleineanfragen.de/baden-wuerttemberg/16/1623-krebserregende-stoffe-in-bio-kraeutertees,16,1623,Krebserregende Stoffe in Bio-Kräutertees,minor,2017-04-10,Baden-Württemberg,FDP/DVP,Dr. Friedrich Bullinger,Ministerium für Ländlichen Raum und Verbraucherschutz
2951,https://kleineanfragen.de/baden-wuerttemberg/16/1612-ausbreitung-des-hantavirus-im-bodenseekreis,16,1612,Ausbreitung des Hantavirus im Bodenseekreis,minor,2017-04-10,Baden-Württemberg,FDP/DVP,Klaus Hoher,"Ministerium für Arbeit und Sozialordnung, Familie, Frauen und Senioren;Ministerium für Ländlichen Raum und Verbraucherschutz;Ministerium für Soziales und Integration"
2952,https://kleineanfragen.de/baden-wuerttemberg/16/1590-mangelnder-tier-und-verbraucherschutz-durch-ausbleibende-marktueberwachung-in-baden-wuerttemberg,16,1590,Mangelnder Tier- und Verbraucherschutz durch ausbleibende Marktüberwachung in Baden-Württemberg?,minor,2017-04-10,Baden-Württemberg,FDP/DVP,Dr. Friedrich Bullinger,"Ministerium für Wirtschaft, Arbeit und Wohnungsbau"
2953,https://kleineanfragen.de/baden-wuerttemberg/16/1588-einsatz-von-kaliumphosphonat-fuer-zertifizierte-biobetriebe,16,1588,Einsatz von Kaliumphosphonat für zertifizierte Biobetriebe,minor,2017-04-10,Baden-Württemberg,Die Grünen,Alexander Schoch;Martin Hahn;Martin Grath;Beate Böhlen;Martina Braun;Reinhold Pix,"Ministerium für Umwelt, Klima und Energiewirtschaft;Ministerium für Ländlichen Raum und Verbraucherschutz"
2954,https://kleineanfragen.de/baden-wuerttemberg/16/1580-moegliche-neuermittlung-der-rechnerischen-erdbebenlasten,16,1580,Mögliche Neuermittlung der rechnerischen Erdbebenlasten,minor,2017-04-10,Baden-Württemberg,Die Grünen,Susanne Bay,"Ministerium für Umwelt, Klima und Energiewirtschaft"
2955,https://kleineanfragen.de/baden-wuerttemberg/16/1514-schwimmen-im-zollernalbkreis,16,1514,Schwimmen im Zollernalbkreis,minor,2017-04-10,Baden-Württemberg,AfD,Stefan Herre,"Ministerium für Soziales und Integration;Ministerium für Ländlichen Raum und Verbraucherschutz;Ministerium für Kultus, Jugend und Sport"
2956,https://kleineanfragen.de/baden-wuerttemberg/16/1424-gasversorger-in-baden-wuerttemberg-und-ihre-preispolitik,16,1424,Gasversorger in Baden-Württemberg und ihre Preispolitik,minor,2017-04-10,Baden-Württemberg,AfD,Stefan Herre,"Ministerium für Umwelt, Klima und Energiewirtschaft"
2957,https://kleineanfragen.de/baden-wuerttemberg/16/1601-moralkompetenz-in-die-lehrplaene-einfuehren,16,1601,Moralkompetenz in die Lehrpläne einführen,minor,2017-04-07,Baden-Württemberg,SPD,Gerhard Kleinböck,"Ministerium für Kultus, Jugend und Sport"
2958,https://kleineanfragen.de/baden-wuerttemberg/16/1584-unterrichtsausfall-im-landkreis-konstanz,16,1584,Unterrichtsausfall im Landkreis Konstanz,minor,2017-04-07,Baden-Württemberg,FDP/DVP,Jürgen Keck,"Ministerium für Kultus, Jugend und Sport"
2959,https://kleineanfragen.de/baden-wuerttemberg/16/1581-unterrichtsausfall-im-landkreis-ludwigsburg,16,1581,Unterrichtsausfall im Landkreis Ludwigsburg,minor,2017-04-07,Baden-Württemberg,FDP/DVP,Timm Kern,"Ministerium für Kultus, Jugend und Sport"
2960,https://kleineanfragen.de/baden-wuerttemberg/16/1559-ausschreibungskriterien-einer-professur-an-katholisch-theologischer-fakultaet,16,1559,Ausschreibungskriterien einer Professur an Katholisch-Theologischer Fakultät,minor,2017-04-07,Baden-Württemberg,FDP/DVP,Nico Weinmann,"Ministerium für Wissenschaft, Forschung und Kunst"
2961,https://kleineanfragen.de/baden-wuerttemberg/16/1528-foerderung-und-unterstuetzung-von-existenzgruendungen-in-mittelbaden,16,1528,Förderung und Unterstützung von Existenzgründungen in Mittelbaden,minor,2017-04-07,Baden-Württemberg,CDU,Tobias Wald,"Ministerium für Wirtschaft, Arbeit und Wohnungsbau"
2962,https://kleineanfragen.de/baden-wuerttemberg/16/1518-u3-betreuung-im-zollernalbkreis-im-regierungsbezirk-tuebingen-und-in-baden-wuerttemberg,16,1518,"U3-Betreuung im Zollernalbkreis, im Regierungsbezirk Tübingen und in Baden-Württemberg",minor,2017-04-07,Baden-Württemberg,AfD,Stefan Herre,"Ministerium für Finanzen;Ministerium für Kultus, Jugend und Sport"
2963,https://kleineanfragen.de/baden-wuerttemberg/16/1611-influenzawelle-im-bodenseekreis,16,1611,Influenzawelle im Bodenseekreis,minor,2017-04-06,Baden-Württemberg,FDP/DVP,Klaus Hoher,"Ministerium für Arbeit und Sozialordnung, Familie, Frauen und Senioren;Ministerium für Soziales und Integration"
2964,https://kleineanfragen.de/baden-wuerttemberg/16/1610-unterrichtsausfall-im-bodenseekreis,16,1610,Unterrichtsausfall im Bodenseekreis,minor,2017-04-06,Baden-Württemberg,FDP/DVP,Klaus Hoher,"Ministerium für Kultus, Jugend und Sport"
2965,https://kleineanfragen.de/baden-wuerttemberg/16/1599-wird-das-baden-wuerttembergische-mehrlingsgeburtenprogramm-fortgefuehrt,16,1599,Wird das baden-württembergische Mehrlingsgeburtenprogramm fortgeführt?,minor,2017-04-06,Baden-Württemberg,SPD,Andreas Kenner,"Ministerium für Arbeit und Sozialordnung, Familie, Frauen und Senioren;Ministerium für Soziales und Integration"
2966,https://kleineanfragen.de/baden-wuerttemberg/16/1596-unterrichtsausfall-in-heilbronn-im-schuljahr-2016-2017,16,1596,Unterrichtsausfall in Heilbronn im Schuljahr 2016/2017,minor,2017-04-06,Baden-Württemberg,FDP/DVP,Nico Weinmann,"Ministerium für Kultus, Jugend und Sport"
2967,https://kleineanfragen.de/baden-wuerttemberg/16/1592-unterrichtsausfall-im-rems-murr-kreis,16,1592,Unterrichtsausfall im Rems-Murr-Kreis,minor,2017-04-06,Baden-Württemberg,FDP/DVP,Jochen Haußmann;Ulrich Goll,"Ministerium für Kultus, Jugend und Sport"
2968,https://kleineanfragen.de/baden-wuerttemberg/16/1579-verkehrssicherheit-fuer-einspurige-verkehrsteilnehmer-auf-der-landesstrasse-l-1175-zwischen-der-abzweigung-l-573,16,1579,Verkehrssicherheit für einspurige Verkehrsteilnehmer auf der Landesstraße L 1175 zwischen der Abzweigung L 573 und Heimsheim,minor,2017-04-06,Baden-Württemberg,FDP/DVP,Erik Schweickert,Ministerium für Verkehr
2969,https://kleineanfragen.de/baden-wuerttemberg/16/1556-genehmigungen-von-windenergieanlagen-vor-dem-1-januar-2017,16,1556,Genehmigungen von Windenergieanlagen vor dem 1. Januar 2017,minor,2017-04-06,Baden-Württemberg,FDP/DVP,Andreas Glück,"Ministerium für Umwelt, Klima und Energiewirtschaft"
2970,https://kleineanfragen.de/baden-wuerttemberg/16/1576-unterrichtsausfall-im-landkreis-freudenstadt,16,1576,Unterrichtsausfall im Landkreis Freudenstadt,minor,2017-04-05,Baden-Württemberg,FDP/DVP,Timm Kern,"Ministerium für Kultus, Jugend und Sport"
2971,https://kleineanfragen.de/baden-wuerttemberg/16/1542-ausschuss-von-exemplaren-in-den-landesbibliotheken,16,1542,Ausschuss von Exemplaren in den Landesbibliotheken,minor,2017-04-05,Baden-Württemberg,FDP/DVP,Nico Weinmann,"Ministerium für Wissenschaft, Forschung und Kunst"
2972,https://kleineanfragen.de/baden-wuerttemberg/16/1511-schliessung-von-schulstandorten-im-zollernalbkreis-zukunft-unserer-schulen-im-laendlichen-raum-sowie-in-baden,16,1511,Schließung von Schulstandorten im Zollernalbkreis – Zukunft unserer Schulen im Ländlichen Raum sowie in Baden-Württemberg,minor,2017-04-05,Baden-Württemberg,AfD,Stefan Herre,"Ministerium für Kultus, Jugend und Sport"
