,html_url,legislative_term,reference,title,interpellation_type,published_at,body,inquiring_parties_wikidata,inquiring_people_wikidata,answering_ministries_wikidata
3283,https://kleineanfragen.de/baden-wuerttemberg/16/939-weitere-fragen-zur-umsatzsteuerpflicht-fuer-jagdgenossenschaften,16,939,Weitere Fragen zur Umsatzsteuerpflicht für Jagdgenossenschaften,minor,2016-11-10,Baden-Württemberg,FDP/DVP,Dr. Friedrich Bullinger,Ministerium für Finanzen
3284,https://kleineanfragen.de/baden-wuerttemberg/16/681-finanzierung-der-bergwachten-in-baden-wuerttemberg,16,681,Finanzierung der Bergwachten in Baden-Württemberg,minor,2016-11-10,Baden-Württemberg,FDP/DVP,Erik Schweickert,"Ministerium für Inneres, Digitalisierung und Migration"
3285,https://kleineanfragen.de/baden-wuerttemberg/16/680-finanzierung-der-bergwachten-in-baden-wuerttemberg,16,680,Finanzierung der Bergwachten in Baden-Württemberg,minor,2016-11-10,Baden-Württemberg,FDP/DVP,Gerhard Aden,"Ministerium für Inneres, Digitalisierung und Migration"
3286,https://kleineanfragen.de/baden-wuerttemberg/16/652-breitbandausbau-in-mittelbaden,16,652,Breitbandausbau in Mittelbaden,minor,2016-11-10,Baden-Württemberg,CDU,Tobias Wald,"Ministerium für Inneres, Digitalisierung und Migration"
3287,https://kleineanfragen.de/baden-wuerttemberg/16/942-sachstand-ortsumfahrung-albstadt-lautlingen-b-463,16,942,Sachstand Ortsumfahrung Albstadt-Lautlingen (B 463),minor,2016-11-09,Baden-Württemberg,SPD,Martin Rivoir,Ministerium für Verkehr
3288,https://kleineanfragen.de/baden-wuerttemberg/16/941-laenderuebergreifendes-semesterticket-fuer-eucor-studierende,16,941,Länderübergreifendes Semesterticket für Eucor-Studierende,minor,2016-11-09,Baden-Württemberg,SPD,Gabi Rolland,"Ministerium für Wissenschaft, Forschung und Kunst;Ministerium für Finanzen;Ministerium für Verkehr"
3289,https://kleineanfragen.de/baden-wuerttemberg/16/931-aktueller-stand-der-einfuehrung-von-benutzer-alters-und-behindertengerechten-wettscheinen-beim-staatlichen-toto,16,931,"Aktueller Stand der Einführung von benutzer-, alters- und behindertengerechten Wettscheinen beim Staatlichen Toto-Lotto Baden-Württemberg",minor,2016-11-08,Baden-Württemberg,FDP/DVP,Dr. Friedrich Bullinger,Ministerium für Finanzen
3290,https://kleineanfragen.de/baden-wuerttemberg/16/928-verspaetungen-im-regionalverkehr-der-deutschen-bahn-zwischen-stuttgart-und-pforzheim-im-oktober-2016,16,928,Verspätungen im Regionalverkehr der Deutschen Bahn zwischen Stuttgart und Pforzheim im Oktober 2016,minor,2016-11-08,Baden-Württemberg,FDP/DVP,Hans-Ulrich Rülke,Ministerium für Verkehr
3291,https://kleineanfragen.de/baden-wuerttemberg/16/927-zustand-und-sanierung-von-landesstrassen-und-radwegen-im-rems-murr-kreis,16,927,Zustand und Sanierung von Landesstraßen und Radwegen im Rems-Murr-Kreis,minor,2016-11-08,Baden-Württemberg,SPD,Gernot Gruber,Ministerium für Verkehr
3292,https://kleineanfragen.de/baden-wuerttemberg/16/926-ausbau-der-glasfasertechnik-im-wahlkreis-bretten,16,926,Ausbau der Glasfasertechnik im Wahlkreis Bretten,minor,2016-11-08,Baden-Württemberg,CDU,Joachim Kößler,"Ministerium für Inneres, Digitalisierung und Migration"
3293,https://kleineanfragen.de/baden-wuerttemberg/16/716-bundesmittel-fuer-sozialen-wohnungsbau-in-baden-wuerttemberg,16,716,Bundesmittel für sozialen Wohnungsbau in Baden-Württemberg,minor,2016-11-08,Baden-Württemberg,FDP/DVP,Gabriele Reich-Gutjahr;Klaus Hoher,"Ministerium für Wirtschaft, Arbeit und Wohnungsbau"
3294,https://kleineanfragen.de/baden-wuerttemberg/16/705-linksextremistische-ausschreitungen-gegen-die-polizei-vom-30-april-bis-1-mai-2016,16,705,Linksextremistische Ausschreitungen gegen die Polizei vom 30. April bis 1. Mai 2016,minor,2016-11-08,Baden-Württemberg,AfD,Stefan Räpple,"Ministerium für Inneres, Digitalisierung und Migration"
3295,https://kleineanfragen.de/baden-wuerttemberg/16/702-mit-per-und-polyfluorierten-chemikalien-pfc-belastete-landwirtschaftliche-flaechen-in-mannheim,16,702,Mit per- und polyfluorierten Chemikalien (PFC) belastete landwirtschaftliche Flächen in Mannheim,minor,2016-11-08,Baden-Württemberg,SPD,Stefan Fulst-Blei;Boris Weirauch,"Ministerium für Ländlichen Raum und Verbraucherschutz;Ministerium für Umwelt, Klima und Energiewirtschaft"
3296,https://kleineanfragen.de/baden-wuerttemberg/16/718-moegliche-abschaffung-des-nachtangelverbots,16,718,Mögliche Abschaffung des Nachtangelverbots,minor,2016-11-07,Baden-Württemberg,FDP/DVP,Klaus Hoher;Dr. Friedrich Bullinger,Ministerium für Ländlichen Raum und Verbraucherschutz
3297,https://kleineanfragen.de/baden-wuerttemberg/16/709-foerderung-der-bundesgartenschau-2019-in-heilbronn-durch-das-land-baden-wuerttemberg,16,709,Förderung der Bundesgartenschau 2019 in Heilbronn durch das Land Baden-Württemberg,minor,2016-11-07,Baden-Württemberg,SPD,Rainer Hinderer,"Ministerium für Wirtschaft, Arbeit und Wohnungsbau;Ministerium für Verkehr;Ministerium für Finanzen;Ministerium für Ländlichen Raum und Verbraucherschutz"
3298,https://kleineanfragen.de/baden-wuerttemberg/16/687-lehrermangel-im-landkreis-heidenheim-und-dem-ostalbkreis,16,687,Lehrermangel im Landkreis Heidenheim und dem Ostalbkreis,minor,2016-11-07,Baden-Württemberg,AfD,Heiner Merz,"Ministerium für Kultus, Jugend und Sport"
3299,https://kleineanfragen.de/baden-wuerttemberg/16/653-unterrichtsversorgung-im-landkreis-emmendingen,16,653,Unterrichtsversorgung im Landkreis Emmendingen,minor,2016-11-07,Baden-Württemberg,SPD,Sabine Wölfle,"Ministerium für Kultus, Jugend und Sport"
3300,https://kleineanfragen.de/baden-wuerttemberg/16/630-zuzug-von-rumaenischen-und-bulgarischen-staatsangehoerigen-nach-baden-wuerttemberg,16,630,Zuzug von rumänischen und bulgarischen Staatsangehörigen nach Baden-Württemberg,minor,2016-11-07,Baden-Württemberg,ABW,Claudia Martin,"Ministerium für Soziales und Integration;Ministerium für Wirtschaft, Arbeit und Wohnungsbau;Ministerium für Inneres, Digitalisierung und Migration"
3301,https://kleineanfragen.de/baden-wuerttemberg/16/627-diebstahlserie-von-navigationsgeraeten-im-bereich-des-polizeipraesidiums-mannheim,16,627,Diebstahlserie von Navigationsgeräten im Bereich des Polizeipräsidiums Mannheim,minor,2016-11-07,Baden-Württemberg,ABW,Claudia Martin,"Ministerium für Inneres, Digitalisierung und Migration"
3302,https://kleineanfragen.de/baden-wuerttemberg/16/622-beschaeftigungsquote-von-asylbewerbern-und-anerkannten-asylbewerbern,16,622,Beschäftigungsquote von Asylbewerbern und anerkannten Asylbewerbern,minor,2016-11-07,Baden-Württemberg,ABW,Jörg Meuthen;Lars Patrick Berg,"Ministerium für Soziales und Integration;Ministerium für Wirtschaft, Arbeit und Wohnungsbau"
3303,https://kleineanfragen.de/baden-wuerttemberg/16/616-daten-zur-fluechtlingssituation-in-baden-wuerttemberg,16,616,Daten zur Flüchtlingssituation in Baden-Württemberg,minor,2016-11-07,Baden-Württemberg,AfD,Hans Peter Stauch,"Ministerium für Inneres, Digitalisierung und Migration"
3304,https://kleineanfragen.de/baden-wuerttemberg/16/560-finanzielle-situation-der-dualen-hochschule-baden-wuerttemberg,16,560,Finanzielle Situation der Dualen Hochschule Baden-Württemberg,major,2016-11-07,Baden-Württemberg,SPD,,Landesregierung
3305,https://kleineanfragen.de/baden-wuerttemberg/16/921-schaeden-durch-kraehen-in-der-landwirtschaft,16,921,Schäden durch Krähen in der Landwirtschaft,minor,2016-11-04,Baden-Württemberg,CDU,Christine Neumann;Patrick Rapp,Ministerium für Ländlichen Raum und Verbraucherschutz
3306,https://kleineanfragen.de/baden-wuerttemberg/16/920-tatsaechliche-ausgaben-im-fluechtlingsbereich,16,920,Tatsächliche Ausgaben im Flüchtlingsbereich,minor,2016-11-03,Baden-Württemberg,SPD,Peter Hofelich,Ministerium für Finanzen
3307,https://kleineanfragen.de/baden-wuerttemberg/16/919-foerderungspraxis-von-kommunalen-bauvorhaben-durch-die-landesregierung,16,919,Förderungspraxis von kommunalen Bauvorhaben durch die Landesregierung,minor,2016-11-03,Baden-Württemberg,FDP/DVP,Hans-Ulrich Rülke,"Ministerium für Wirtschaft, Arbeit und Wohnungsbau"
3308,https://kleineanfragen.de/baden-wuerttemberg/16/628-kategorisierung-des-sechsspurigen-ausbaus-der-autobahn-a-5-zwischen-hemsbach-und-heidelberg-im,16,628,Kategorisierung des sechsspurigen Ausbaus der Autobahn (A) 5 zwischen Hemsbach und Heidelberg im Bundesverkehrswegeplan 2030,minor,2016-11-03,Baden-Württemberg,ABW,Claudia Martin,Ministerium für Verkehr
3309,https://kleineanfragen.de/baden-wuerttemberg/16/609-100-tage-branichtunnel-entwicklung-des-verkehrsaufkommens-in-der-region,16,609,100 Tage „Branichtunnel“ – Entwicklung des Verkehrsaufkommens in der Region,minor,2016-11-03,Baden-Württemberg,SPD,Gerhard Kleinböck,Ministerium für Verkehr
3310,https://kleineanfragen.de/baden-wuerttemberg/16/918-sechsstreifiger-ausbau-der-bundesautobahn-a-5-von-heidelberg-bis-hemsbach,16,918,Sechsstreifiger Ausbau der Bundesautobahn A 5 von Heidelberg bis Hemsbach,minor,2016-11-02,Baden-Württemberg,CDU,Albrecht Schütte,Ministerium für Verkehr
3311,https://kleineanfragen.de/baden-wuerttemberg/16/917-radweg-und-strasseninfrastruktur-im-suedlichen-wahlkreis-33-landkreis-rastatt,16,917,Radweg- und Straßeninfrastruktur im südlichen Wahlkreis 33 (Landkreis Rastatt),minor,2016-11-02,Baden-Württemberg,CDU,Tobias Wald,Ministerium für Verkehr
3312,https://kleineanfragen.de/baden-wuerttemberg/16/884-situation-der-polizei-beim-polizeipraesidium-heilbronn,16,884,Situation der Polizei beim Polizeipräsidium Heilbronn,minor,2016-11-02,Baden-Württemberg,AfD,Rainer Podeswa;Thomas Axel Palka,"Ministerium für Inneres, Digitalisierung und Migration"
3313,https://kleineanfragen.de/baden-wuerttemberg/16/626-situation-von-zugbegleitern-fahrkartenkontrolleuren-und-anderen-oeffentlichen-bediensteten,16,626,"Situation von Zugbegleitern, Fahrkartenkontrolleuren und anderen öffentlichen Bediensteten",minor,2016-11-02,Baden-Württemberg,ABW,Jörg Meuthen;Lars Patrick Berg,"Ministerium für Inneres, Digitalisierung und Migration"
3314,https://kleineanfragen.de/baden-wuerttemberg/16/615-lehrerversorgung-im-landkreis-main-tauber,16,615,Lehrerversorgung im Landkreis Main-Tauber,minor,2016-11-02,Baden-Württemberg,FDP/DVP,Dr. Friedrich Bullinger,"Ministerium für Kultus, Jugend und Sport"
3315,https://kleineanfragen.de/baden-wuerttemberg/16/579-zustand-der-bundesstrasse-b-10-bruecke-ueber-die-enz,16,579,Zustand der Bundesstraße (B) 10-Brücke über die Enz,minor,2016-11-02,Baden-Württemberg,FDP/DVP,Erik Schweickert,Ministerium für Verkehr
3316,https://kleineanfragen.de/baden-wuerttemberg/16/914-drogen-in-den-kreisen-tuttlingen-und-schwarzwald-baar,16,914,Drogen in den Kreisen Tuttlingen und Schwarzwald-Baar,minor,2016-10-31,Baden-Württemberg,AfD,Lars Patrick Berg,"Ministerium der Justiz und für Europa;Ministerium für Soziales und Integration;Ministerium für Kultus, Jugend und Sport;Ministerium für Inneres, Digitalisierung und Migration"
3317,https://kleineanfragen.de/baden-wuerttemberg/16/913-bedrohung-der-inneren-sicherheit-durch-angriffe-von-clowns,16,913,Bedrohung der inneren Sicherheit durch Angriffe von Clowns,minor,2016-10-31,Baden-Württemberg,AfD,Lars Patrick Berg,"Ministerium für Inneres, Digitalisierung und Migration"
3318,https://kleineanfragen.de/baden-wuerttemberg/16/912-kostenerstattung-fuer-unbegleitete-minderjaehrige-auslaender-uma-in-den-landkreisen-rems-murr-tuttlingen-und,16,912,"Kostenerstattung für „Unbegleitete Minderjährige Ausländer“ (UMA) in den Landkreisen Rems-Murr, Tuttlingen und Schwarzwald-Baar",minor,2016-10-31,Baden-Württemberg,AfD,Jörg Meuthen;Lars Patrick Berg,"Ministerium für Inneres, Digitalisierung und Migration;Ministerium der Justiz und für Europa;Ministerium für Soziales und Integration"
3319,https://kleineanfragen.de/baden-wuerttemberg/16/911-landesstrasse-l-514,16,911,Landesstraße L 514,minor,2016-10-31,Baden-Württemberg,AfD,Christina Baum,Ministerium für Verkehr
3320,https://kleineanfragen.de/baden-wuerttemberg/16/632-weidemilch-in-baden-wuerttemberg,16,632,Weidemilch in Baden-Württemberg,minor,2016-10-31,Baden-Württemberg,CDU,Thomas Dörflinger,Ministerium für Ländlichen Raum und Verbraucherschutz
3321,https://kleineanfragen.de/baden-wuerttemberg/16/629-kohlenstoffdioxid-co2-betaeubung-von-schweinen-beim-schlachtvorgang,16,629,Kohlenstoffdioxid (CO2)-Betäubung von Schweinen beim Schlachtvorgang,minor,2016-10-31,Baden-Württemberg,ABW,Claudia Martin,Ministerium für Ländlichen Raum und Verbraucherschutz
3322,https://kleineanfragen.de/baden-wuerttemberg/16/624-gewalt-in-gefaengnissen-in-baden-wuerttemberg,16,624,Gewalt in Gefängnissen in Baden-Württemberg,minor,2016-10-31,Baden-Württemberg,ABW,Jörg Meuthen;Lars Patrick Berg,Ministerium der Justiz und für Europa
3323,https://kleineanfragen.de/baden-wuerttemberg/16/621-homo-ehe-ist-erlaubt-was-bezweckt-die-landesregierung-mit-ihrer-falschen-darstellung-der-rechtslage-in-deutschland,16,621,„Homo-Ehe ist erlaubt“ – was bezweckt die Landesregierung mit ihrer falschen Darstellung der Rechtslage in Deutschland?,minor,2016-10-31,Baden-Württemberg,FDP/DVP,Hans-Ulrich Rülke,Staatsministerium
3324,https://kleineanfragen.de/baden-wuerttemberg/16/524-familiennachzug-von-fluechtlingen-in-baden-wuerttemberg,16,524,Familiennachzug von Flüchtlingen in Baden-Württemberg,major,2016-10-31,Baden-Württemberg,AfD,,Landesregierung
3325,https://kleineanfragen.de/baden-wuerttemberg/16/908-einsetzung-des-rektors-an-der-hochschule-heilbronn,16,908,Einsetzung des Rektors an der Hochschule Heilbronn,minor,2016-10-28,Baden-Württemberg,SPD,Reinhold Gall,"Ministerium für Wissenschaft, Forschung und Kunst"
3326,https://kleineanfragen.de/baden-wuerttemberg/16/899-betreuungsangebote-fuer-schuelerinnen-und-schueler-im-main-tauber-kreis,16,899,Betreuungsangebote für Schülerinnen und Schüler im Main-Tauber-Kreis,minor,2016-10-28,Baden-Württemberg,CDU,Wolfgang Reinhart,"Ministerium für Kultus, Jugend und Sport"
3327,https://kleineanfragen.de/baden-wuerttemberg/16/625-versorgung-mit-lehrkraeften-in-den-kreisen-rems-murr-karlsruhe-schwarzwald-baar-tuttlingen-und-rhein-neckar,16,625,"Versorgung mit Lehrkräften in den Kreisen Rems-Murr, Karlsruhe, Schwarzwald-Baar, Tuttlingen und Rhein-Neckar",minor,2016-10-28,Baden-Württemberg,ABW,Jörg Meuthen;Claudia Martin;Lars Patrick Berg,"Ministerium für Kultus, Jugend und Sport;Ministerium für Finanzen"
3328,https://kleineanfragen.de/baden-wuerttemberg/16/549-planung-und-bau-des-retentionsraums-polders-bellenkopf-rappenwoert,16,549,Planung und Bau des Retentionsraums/Polders Bellenkopf/Rappenwört,minor,2016-10-28,Baden-Württemberg,Die Grünen,Bettina Lisbach,"Ministerium für Umwelt, Klima und Energiewirtschaft"
3329,https://kleineanfragen.de/baden-wuerttemberg/16/495-datenschutz-bei-der-datenweitergabe-an-die-gebuehreneinzugszentrale-gez,16,495,Datenschutz bei der Datenweitergabe an die Gebühreneinzugszentrale (GEZ),minor,2016-10-28,Baden-Württemberg,ABW,Anton Baron,Staatsministerium
3330,https://kleineanfragen.de/baden-wuerttemberg/16/893-auswirkungen-der-windkraftplanungen-bb-02-auf-die-stadt-heimsheim,16,893,Auswirkungen der Windkraftplanungen BB-02 auf die Stadt Heimsheim,minor,2016-10-27,Baden-Württemberg,FDP/DVP,Erik Schweickert,"Ministerium für Wirtschaft, Arbeit und Wohnungsbau"
3331,https://kleineanfragen.de/baden-wuerttemberg/16/892-unterrichtsversorgung-an-den-schulen-im-rems-murr-kreis,16,892,Unterrichtsversorgung an den Schulen im Rems-Murr-Kreis,minor,2016-10-27,Baden-Württemberg,SPD,Gernot Gruber,"Ministerium für Kultus, Jugend und Sport"
3332,https://kleineanfragen.de/baden-wuerttemberg/16/885-illegales-muslimisches-gebetszentrum-in-weinheim,16,885,Illegales muslimisches Gebetszentrum in Weinheim?,minor,2016-10-27,Baden-Württemberg,AfD,Claudia Martin,"Ministerium für Inneres, Digitalisierung und Migration"
3333,https://kleineanfragen.de/baden-wuerttemberg/16/883-rettungsdienste-und-aerzte-im-stadt-und-landkreis-heilbronn,16,883,Rettungsdienste und Ärzte im Stadt- und Landkreis Heilbronn,minor,2016-10-27,Baden-Württemberg,AfD,Thomas Axel Palka,"Ministerium für Inneres, Digitalisierung und Migration"
3334,https://kleineanfragen.de/baden-wuerttemberg/16/614-lehrerversorgung-im-landkreis-schwaebisch-hall,16,614,Lehrerversorgung im Landkreis Schwäbisch Hall,minor,2016-10-27,Baden-Württemberg,FDP/DVP,Dr. Friedrich Bullinger,"Ministerium für Kultus, Jugend und Sport"
3335,https://kleineanfragen.de/baden-wuerttemberg/16/613-lehrerversorgung-im-landkreis-hohenlohe,16,613,Lehrerversorgung im Landkreis Hohenlohe,minor,2016-10-27,Baden-Württemberg,FDP/DVP,Dr. Friedrich Bullinger,"Ministerium für Kultus, Jugend und Sport"
3336,https://kleineanfragen.de/baden-wuerttemberg/16/591-lehrerversorgung-im-rems-murr-kreis,16,591,Lehrerversorgung im Rems-Murr-Kreis,minor,2016-10-27,Baden-Württemberg,FDP/DVP,Ulrich Goll;Jochen Haußmann,"Ministerium für Kultus, Jugend und Sport"
3337,https://kleineanfragen.de/baden-wuerttemberg/16/587-aktuelle-fluechtlingsbelegung-und-situation-im-landkreis-schwaebisch-hall,16,587,Aktuelle Flüchtlingsbelegung und Situation im Landkreis Schwäbisch Hall,minor,2016-10-27,Baden-Württemberg,ABW,Udo Stein,"Ministerium für Inneres, Digitalisierung und Migration"
3338,https://kleineanfragen.de/baden-wuerttemberg/16/586-polizeiposten-und-polizeibeamte-im-landkreis-schwaebisch-hall,16,586,Polizeiposten und Polizeibeamte im Landkreis Schwäbisch Hall,minor,2016-10-27,Baden-Württemberg,ABW,Udo Stein,"Ministerium für Inneres, Digitalisierung und Migration"
3339,https://kleineanfragen.de/baden-wuerttemberg/16/585-gefaelschte-identitaeten-von-eingereisten-migranten-in-baden-wuerttemberg,16,585,Gefälschte Identitäten von eingereisten Migranten in Baden-Württemberg,minor,2016-10-27,Baden-Württemberg,ABW,Heinrich Kuhn,"Ministerium für Inneres, Digitalisierung und Migration"
3340,https://kleineanfragen.de/baden-wuerttemberg/16/559-zuverlaessigkeit-von-fluechtlingshilfsorganisationen,16,559,Zuverlässigkeit von Flüchtlingshilfsorganisationen,minor,2016-10-27,Baden-Württemberg,ABW,Rainer Balzer,"Ministerium für Inneres, Digitalisierung und Migration"
3341,https://kleineanfragen.de/baden-wuerttemberg/16/886-entsorgung-von-styropor-und-styrodur-daemmstoffen,16,886,Entsorgung von Styropor und Styrodur/Dämmstoffen,major,2016-10-26,Baden-Württemberg,AfD,,Landesregierung
3342,https://kleineanfragen.de/baden-wuerttemberg/16/882-co2-bilanz-eines-windparks-am-beispiel-sulz-dornhan,16,882,CO2-Bilanz eines Windparks am Beispiel Sulz/Dornhan,minor,2016-10-26,Baden-Württemberg,AfD,Emil Sänze,"Ministerium für Umwelt, Klima und Energiewirtschaft"
3343,https://kleineanfragen.de/baden-wuerttemberg/16/877-digitalisierung-region-heilbronn-franken,16,877,Digitalisierung Region Heilbronn-Franken,minor,2016-10-26,Baden-Württemberg,Die Grünen,Jutta Niemann;Susanne Bay,"Ministerium für Inneres, Digitalisierung und Migration"
3344,https://kleineanfragen.de/baden-wuerttemberg/16/874-mineraloelbestandteile-in-vegetarischen-lebensmitteln,16,874,Mineralölbestandteile in vegetarischen Lebensmitteln,minor,2016-10-26,Baden-Württemberg,FDP/DVP,Dr. Friedrich Bullinger,Ministerium für Ländlichen Raum und Verbraucherschutz
3345,https://kleineanfragen.de/baden-wuerttemberg/16/873-sicherheit-an-bahnhoefen-entlang-der-residenzbahn-der-nagoldbahn-und-der-zugverbindung-auf-der-relation-muehlacker,16,873,"Sicherheit an Bahnhöfen entlang der Residenzbahn, der Nagoldbahn und der Zugverbindung auf der Relation Mühlacker-Bruchsal",minor,2016-10-26,Baden-Württemberg,FDP/DVP,Erik Schweickert,"Ministerium für Verkehr;Ministerium für Inneres, Digitalisierung und Migration"
3346,https://kleineanfragen.de/baden-wuerttemberg/16/576-borkenkaefer-monitoring-des-nationalparks-schwarzwald,16,576,Borkenkäfer-Monitoring des Nationalparks Schwarzwald,minor,2016-10-26,Baden-Württemberg,FDP/DVP,Dr. Friedrich Bullinger,"Ministerium für Ländlichen Raum und Verbraucherschutz;Ministerium für Umwelt, Klima und Energiewirtschaft"
3347,https://kleineanfragen.de/baden-wuerttemberg/16/554-leistungen-des-landes-baden-wuerttemberg-an-politische-parteien-und-stiftungen,16,554,Leistungen des Landes Baden-Württemberg an politische Parteien und Stiftungen,minor,2016-10-26,Baden-Württemberg,ABW,Anton Baron,Staatsministerium
3348,https://kleineanfragen.de/baden-wuerttemberg/16/406-gleichstellungsbeauftragte-in-baden-wuerttemberg,16,406,Gleichstellungsbeauftragte in Baden-Württemberg,minor,2016-10-26,Baden-Württemberg,AfD,Christina Baum,"Ministerium für Soziales und Integration;Ministerium für Arbeit und Sozialordnung, Familie, Frauen und Senioren"
3349,https://kleineanfragen.de/baden-wuerttemberg/16/592-verkehrsinfrastruktur-im-bereich-der-messe-stuttgart,16,592,Verkehrsinfrastruktur im Bereich der Messe Stuttgart,minor,2016-10-25,Baden-Württemberg,FDP/DVP,Gabriele Reich-Gutjahr;Hans-Ulrich Rülke,Ministerium für Verkehr
3350,https://kleineanfragen.de/baden-wuerttemberg/16/575-lehrerversorgung-heilbronn,16,575,Lehrerversorgung Heilbronn,minor,2016-10-25,Baden-Württemberg,FDP/DVP,Nico Weinmann,"Ministerium für Kultus, Jugend und Sport"
3351,https://kleineanfragen.de/baden-wuerttemberg/16/569-applikationen-fuer-mobiltelefone-zur-kommunikation-an-die-bevoelkerung-im-krisenfall,16,569,Applikationen für Mobiltelefone zur Kommunikation an die Bevölkerung im Krisenfall,minor,2016-10-25,Baden-Württemberg,ABW,Jörg Meuthen;Lars Patrick Berg,"Ministerium für Inneres, Digitalisierung und Migration"
3352,https://kleineanfragen.de/baden-wuerttemberg/16/568-landesweiter-und-einheitlicher-handwerkerparkausweis,16,568,Landesweiter und einheitlicher Handwerkerparkausweis,minor,2016-10-25,Baden-Württemberg,ABW,Jörg Meuthen;Lars Patrick Berg,"Ministerium für Inneres, Digitalisierung und Migration"
3353,https://kleineanfragen.de/baden-wuerttemberg/16/509-barrierefreiheit-im-schienenpersonennahverkehr-im-landkreis-karlsruhe,16,509,Barrierefreiheit im Schienenpersonennahverkehr im Landkreis Karlsruhe,minor,2016-10-25,Baden-Württemberg,Die Grünen,Andrea Schwarz,Ministerium für Verkehr
3354,https://kleineanfragen.de/baden-wuerttemberg/16/445-parkerleichterung-fuer-menschen-mit-behinderung-mit-merkzeichen-h,16,445,Parkerleichterung für Menschen mit Behinderung mit Merkzeichen „H“,minor,2016-10-25,Baden-Württemberg,SPD,Sascha Binder,"Ministerium für Soziales und Integration;Ministerium für Arbeit und Sozialordnung, Familie, Frauen und Senioren"
3355,https://kleineanfragen.de/baden-wuerttemberg/16/433-pflegesituation-im-wahlkreis-biberach,16,433,Pflegesituation im Wahlkreis Biberach,minor,2016-10-25,Baden-Württemberg,CDU,Thomas Dörflinger,"Ministerium für Soziales und Integration;Ministerium für Arbeit und Sozialordnung, Familie, Frauen und Senioren"
3356,https://kleineanfragen.de/baden-wuerttemberg/16/859-zukunft-der-gewaesser-katzenbach-und-steinbachsee-im-landschaftsschutzgebiet-glemswald,16,859,Zukunft der Gewässer Katzenbach- und Steinbachsee im Landschaftsschutzgebiet Glemswald,minor,2016-10-24,Baden-Württemberg,FDP/DVP,Gabriele Reich-Gutjahr,Ministerium für Ländlichen Raum und Verbraucherschutz
3357,https://kleineanfragen.de/baden-wuerttemberg/16/858-zusatzkosten-bei-stuttgart-21-wegen-bergmaennischer-untertunnelung-von-baeumen-und-umsiedlung-von-eidechsen,16,858,Zusatzkosten bei Stuttgart 21 wegen bergmännischer Untertunnelung von Bäumen und Umsiedlung von Eidechsen,minor,2016-10-24,Baden-Württemberg,CDU,Albrecht Schütte,Ministerium für Verkehr
3358,https://kleineanfragen.de/baden-wuerttemberg/16/570-internationale-bauausstellung-iba-in-der-region-stuttgart-2027,16,570,Internationale Bauausstellung (IBA) in der Region Stuttgart 2027,minor,2016-10-24,Baden-Württemberg,ABW,Jörg Meuthen;Lars Patrick Berg,"Ministerium für Wirtschaft, Arbeit und Wohnungsbau"
3359,https://kleineanfragen.de/baden-wuerttemberg/16/567-auswirkungen-des-austritts-grossbritanniens-aus-der-eu-auf-die-wirtschaft-in-baden-wuerttemberg,16,567,Auswirkungen des Austritts Großbritanniens aus der EU auf die Wirtschaft in Baden-Württemberg,minor,2016-10-24,Baden-Württemberg,ABW,Jörg Meuthen;Lars Patrick Berg,"Ministerium der Justiz und für Europa;Ministerium für Ländlichen Raum und Verbraucherschutz;Ministerium für Inneres, Digitalisierung und Migration;Ministerium für Wirtschaft, Arbeit und Wohnungsbau"
3360,https://kleineanfragen.de/baden-wuerttemberg/16/566-wohnungssituation-im-landkreis-emmendingen,16,566,Wohnungssituation im Landkreis Emmendingen,minor,2016-10-24,Baden-Württemberg,SPD,Sabine Wölfle,"Ministerium für Wirtschaft, Arbeit und Wohnungsbau"
3361,https://kleineanfragen.de/baden-wuerttemberg/16/857-geplanter-windpark-greut,16,857,Geplanter Windpark „Greut“,minor,2016-10-23,Baden-Württemberg,AfD,Heiner Merz,"Ministerium für Umwelt, Klima und Energiewirtschaft"
3362,https://kleineanfragen.de/baden-wuerttemberg/16/856-ortsumgehung-koenigshofen,16,856,Ortsumgehung Königshofen,minor,2016-10-23,Baden-Württemberg,AfD,Christina Baum,Ministerium für Verkehr
3363,https://kleineanfragen.de/baden-wuerttemberg/16/855-aktueller-stand-der-planungen-zur-bundesstrasse-b-10-neu-im-raum-geislingen,16,855,Aktueller Stand der Planungen zur Bundesstraße (B) 10 neu im Raum Geislingen,minor,2016-10-21,Baden-Württemberg,SPD,Sascha Binder,Ministerium für Verkehr
3364,https://kleineanfragen.de/baden-wuerttemberg/16/854-personelle-ausstattung-und-gefaehrdungslage-in-der-justizvollzugsanstalt-jva-schwaebisch-hall,16,854,Personelle Ausstattung und Gefährdungslage in der Justizvollzugsanstalt (JVA) Schwäbisch-Hall,minor,2016-10-21,Baden-Württemberg,FDP/DVP,Dr. Friedrich Bullinger,Ministerium der Justiz und für Europa
