,html_url,legislative_term,reference,title,interpellation_type,published_at,body,inquiring_parties_wikidata,inquiring_people_wikidata,answering_ministries_wikidata
2577,https://kleineanfragen.de/baden-wuerttemberg/16/2569-havarie-des-eisenbahntunnels-rastatt-ursachen-und-wirkungen,16,2569,Havarie des Eisenbahntunnels Rastatt – Ursachen und Wirkungen,major,2017-10-05,Baden-Württemberg,AfD,,Landesregierung
2578,https://kleineanfragen.de/baden-wuerttemberg/16/2564-verwaltungsvereinbarungen-zu-kostenerstattung-von-polizeikraeften-anderer-bundeslaender,16,2564,Verwaltungsvereinbarungen zu Kostenerstattung von Polizeikräften anderer Bundesländer,minor,2017-10-05,Baden-Württemberg,SPD,Sascha Binder,"Ministerium für Inneres, Digitalisierung und Migration"
2579,https://kleineanfragen.de/baden-wuerttemberg/16/2563-immissionsschutz-im-umkreis-des-windparks-suedliche-ortenau,16,2563,Immissionsschutz im Umkreis des Windparks „Südliche Ortenau“,minor,2017-10-05,Baden-Württemberg,FDP/DVP,Andreas Glück,"Ministerium für Umwelt, Klima und Energiewirtschaft"
2580,https://kleineanfragen.de/baden-wuerttemberg/16/2533-workshop-facetten-des-populismus-in-mannheim,16,2533,Workshop „Facetten des Populismus“ in Mannheim,minor,2017-10-05,Baden-Württemberg,AfD,Rüdiger Klos;Christina Baum,"Ministerium für Arbeit und Sozialordnung, Familie, Frauen und Senioren;Ministerium für Soziales und Integration"
2581,https://kleineanfragen.de/baden-wuerttemberg/16/2572-polizeiarbeit-im-bereich-des-kuenftigen-polizeipraesidiums-nordschwarzwald,16,2572,Polizeiarbeit im Bereich des künftigen Polizeipräsidiums Nordschwarzwald,minor,2017-10-04,Baden-Württemberg,FDP/DVP,Erik Schweickert;Hans-Ulrich Rülke,"Ministerium für Inneres, Digitalisierung und Migration"
2582,https://kleineanfragen.de/baden-wuerttemberg/16/2568-situation-der-alleinerziehenden-im-wahlkreis-54-villingen-schwenningen,16,2568,Situation der Alleinerziehenden im Wahlkreis 54 Villingen-Schwenningen,minor,2017-10-04,Baden-Württemberg,CDU,Karl Rombach,"Ministerium für Arbeit und Sozialordnung, Familie, Frauen und Senioren;Ministerium für Soziales und Integration"
2583,https://kleineanfragen.de/baden-wuerttemberg/16/2558-radwegenetz-im-landkreis-schwaebisch-hall-zukunftsperspektiven-fuer-den-radtourismus-vor-ort,16,2558,Radwegenetz im Landkreis Schwäbisch Hall − Zukunftsperspektiven für den Radtourismus vor Ort,minor,2017-10-04,Baden-Württemberg,FDP/DVP,Dr. Friedrich Bullinger,"Ministerium für Inneres, Digitalisierung und Migration;Ministerium für Verkehr"
2584,https://kleineanfragen.de/baden-wuerttemberg/16/2567-zusammenarbeit-mit-tuerkischen-organisationen,16,2567,Zusammenarbeit mit türkischen Organisationen,minor,2017-10-02,Baden-Württemberg,CDU,Bernhard Lasotta;Siegfried Lorek,"Ministerium für Soziales und Integration;Ministerium für Inneres, Digitalisierung und Migration;Ministerium für Kultus, Jugend und Sport"
2585,https://kleineanfragen.de/baden-wuerttemberg/16/2561-mobilfunk-im-enzkreis-und-im-landkreis-karlsruhe,16,2561,Mobilfunk im Enzkreis und im Landkreis Karlsruhe,minor,2017-10-02,Baden-Württemberg,FDP/DVP,Erik Schweickert,"Ministerium für Finanzen;Ministerium für Inneres, Digitalisierung und Migration;Ministerium für Wirtschaft, Arbeit und Wohnungsbau"
2586,https://kleineanfragen.de/baden-wuerttemberg/16/2559-wiederholter-stoerfall-in-einer-biogasanlage-in-stachenhausen-gemeinde-schoental-im-landkreis-hohenlohe-aktueller,16,2559,"Wiederholter Störfall in einer Biogasanlage in Stachenhausen (Gemeinde Schöntal im Landkreis Hohenlohe): Aktueller Sachstand, Ursachenforschung und Folgen für die Vegetation und den Fischbestand im betroffenen Sindelbach",minor,2017-10-02,Baden-Württemberg,FDP/DVP,Dr. Friedrich Bullinger,"Ministerium für Ländlichen Raum und Verbraucherschutz;Ministerium für Umwelt, Klima und Energiewirtschaft"
2587,https://kleineanfragen.de/baden-wuerttemberg/16/2557-weiterbestand-des-sogenannten-scala-wehrs-in-tuttlingen,16,2557,Weiterbestand des sogenannten Scala-Wehrs in Tuttlingen,minor,2017-10-02,Baden-Württemberg,Die Grünen,Dorothea Wehinger;Bettina Lisbach,"Ministerium für Umwelt, Klima und Energiewirtschaft"
2588,https://kleineanfragen.de/baden-wuerttemberg/16/2470-ausgaben-fuer-die-erstaufnahme-von-fluechtlingen-im-einzelplan-03-des-landeshaushalts-2017,16,2470,Ausgaben für die Erstaufnahme von Flüchtlingen im Einzelplan 03 des Landeshaushalts 2017,minor,2017-10-02,Baden-Württemberg,AfD,Klaus Dürr,"Ministerium für Inneres, Digitalisierung und Migration"
2589,https://kleineanfragen.de/baden-wuerttemberg/16/2469-fluechtlingskosten-im-einzelplan-03-des-landeshaushalts-2017,16,2469,Flüchtlingskosten im Einzelplan 03 des Landeshaushalts 2017,minor,2017-10-02,Baden-Württemberg,AfD,Klaus Dürr,"Ministerium für Finanzen;Ministerium für Inneres, Digitalisierung und Migration"
2590,https://kleineanfragen.de/baden-wuerttemberg/16/2556-rueckstaende-von-pflanzenschutzmitteln-bei-steinobst-aus-der-europaeischen-union-und-aus-der-tuerkei,16,2556,Rückstände von Pflanzenschutzmitteln bei Steinobst aus der Europäischen Union und aus der Türkei,minor,2017-09-29,Baden-Württemberg,FDP/DVP,Klaus Hoher;Dr. Friedrich Bullinger,Ministerium für Ländlichen Raum und Verbraucherschutz
2591,https://kleineanfragen.de/baden-wuerttemberg/16/2549-umgang-der-landesregierung-mit-problemimmobilien-in-baden-wuerttembergischen-kommunen,16,2549,Umgang der Landesregierung mit Problemimmobilien in baden-württembergischen Kommunen,minor,2017-09-29,Baden-Württemberg,SPD,Boris Weirauch,"Ministerium für Inneres, Digitalisierung und Migration"
2592,https://kleineanfragen.de/baden-wuerttemberg/16/2547-aktivitaeten-der-identitaeren-bewegung-in-baden-wuerttemberg,16,2547,Aktivitäten der „Identitären Bewegung“ in Baden-Württemberg,minor,2017-09-29,Baden-Württemberg,SPD,Boris Weirauch,"Ministerium für Inneres, Digitalisierung und Migration"
2593,https://kleineanfragen.de/baden-wuerttemberg/16/2546-minimierung-stadtklimatischer-belastungen-in-hitzesommern,16,2546,Minimierung stadtklimatischer Belastungen in Hitzesommern,minor,2017-09-29,Baden-Württemberg,Die Grünen,Bettina Lisbach;Susanne Bay,"Ministerium für Soziales und Integration;Ministerium für Umwelt, Klima und Energiewirtschaft;Ministerium für Wirtschaft, Arbeit und Wohnungsbau"
2594,https://kleineanfragen.de/baden-wuerttemberg/16/2531-rahmenbedingungen-von-landesfoerderprogrammen-auf-kommunaler-ebene,16,2531,Rahmenbedingungen von Landesförderprogrammen auf kommunaler Ebene,minor,2017-09-29,Baden-Württemberg,FDP/DVP,Hans-Ulrich Rülke,"Ministerium für Ländlichen Raum und Verbraucherschutz;Ministerium für Soziales und Integration;Ministerium für Kultus, Jugend und Sport;Ministerium für Wirtschaft, Arbeit und Wohnungsbau"
2595,https://kleineanfragen.de/baden-wuerttemberg/16/2528-artenschutz-bei-windenergievorhaben,16,2528,Artenschutz bei Windenergievorhaben,minor,2017-09-29,Baden-Württemberg,FDP/DVP,Andreas Glück,"Ministerium für Wirtschaft, Arbeit und Wohnungsbau;Ministerium für Ländlichen Raum und Verbraucherschutz;Ministerium für Umwelt, Klima und Energiewirtschaft"
2596,https://kleineanfragen.de/baden-wuerttemberg/16/2359-foerderung-der-beruflichen-weiterbildung-in-baden-wuerttemberg,16,2359,Förderung der beruflichen Weiterbildung in Baden-Württemberg,major,2017-09-29,Baden-Württemberg,SPD,,Landesregierung
2597,https://kleineanfragen.de/baden-wuerttemberg/16/2554-praktische-probleme-bei-der-foerderung-von-steillagenweinbau,16,2554,Praktische Probleme bei der Förderung von Steillagenweinbau,minor,2017-09-28,Baden-Württemberg,FDP/DVP,Klaus Hoher;Dr. Friedrich Bullinger,Ministerium für Ländlichen Raum und Verbraucherschutz
2598,https://kleineanfragen.de/baden-wuerttemberg/16/2541-risikovorsorge-bei-banken-und-sparkassen-in-baden-wuerttemberg,16,2541,Risikovorsorge bei Banken und Sparkassen in Baden-Württemberg,minor,2017-09-28,Baden-Württemberg,AfD,Bernd Grimmer,Ministerium für Finanzen
2599,https://kleineanfragen.de/baden-wuerttemberg/16/2540-kosten-der-haertefallkommission,16,2540,Kosten der Härtefallkommission,minor,2017-09-28,Baden-Württemberg,AfD,Klaus Dürr,"Ministerium für Inneres, Digitalisierung und Migration"
2600,https://kleineanfragen.de/baden-wuerttemberg/16/2537-zeitliche-umsetzung-der-polizeireform,16,2537,Zeitliche Umsetzung der Polizeireform,minor,2017-09-28,Baden-Württemberg,AfD,Jörg Meuthen;Klaus Dürr;Lars Patrick Berg,"Ministerium für Inneres, Digitalisierung und Migration"
2601,https://kleineanfragen.de/baden-wuerttemberg/16/2532-entwicklung-der-bahninfrastruktur-im-main-tauber-kreis,16,2532,Entwicklung der Bahninfrastruktur im Main-Tauber-Kreis,minor,2017-09-28,Baden-Württemberg,AfD,Christina Baum,Ministerium für Verkehr
2602,https://kleineanfragen.de/baden-wuerttemberg/16/2513-foerderung-urbaner-seilbahnen,16,2513,Förderung urbaner Seilbahnen,minor,2017-09-28,Baden-Württemberg,SPD,Martin Rivoir,"Ministerium für Wirtschaft, Arbeit und Wohnungsbau;Ministerium für Verkehr"
2603,https://kleineanfragen.de/baden-wuerttemberg/16/2511-kraftfahrzeugkennzeichen-mit-extremistischen-chiffren,16,2511,Kraftfahrzeugkennzeichen mit extremistischen Chiffren,minor,2017-09-28,Baden-Württemberg,SPD,Boris Weirauch,"Ministerium für Inneres, Digitalisierung und Migration;Ministerium für Verkehr"
2604,https://kleineanfragen.de/baden-wuerttemberg/16/2477-verspaetungen-der-deutschen-bahn-ag-auf-der-bahnstrecke-stuttgart-pforzheim-und-pforzheim-stuttgart,16,2477,Verspätungen der Deutschen Bahn AG auf der Bahnstrecke Stuttgart–Pforzheim und Pforzheim–Stuttgart,minor,2017-09-28,Baden-Württemberg,FDP/DVP,Hans-Ulrich Rülke,Ministerium für Verkehr
2605,https://kleineanfragen.de/baden-wuerttemberg/16/2552-zukunft-der-musikgymnasien-in-baden-wuerttemberg,16,2552,Zukunft der Musikgymnasien in Baden-Württemberg,minor,2017-09-27,Baden-Württemberg,Die Grünen,Jürgen Walter,"Ministerium für Wissenschaft, Forschung und Kunst;Ministerium für Kultus, Jugend und Sport"
2606,https://kleineanfragen.de/baden-wuerttemberg/16/2534-schwimmfaehigkeit-im-landkreis-heidenheim,16,2534,Schwimmfähigkeit im Landkreis Heidenheim,minor,2017-09-27,Baden-Württemberg,AfD,Heiner Merz,"Ministerium für Ländlichen Raum und Verbraucherschutz;Ministerium für Umwelt, Klima und Energiewirtschaft;Ministerium für Inneres, Digitalisierung und Migration;Ministerium für Kultus, Jugend und Sport"
2607,https://kleineanfragen.de/baden-wuerttemberg/16/2505-ausgabenansaetze-in-der-mittelfristigen-finanzplanung,16,2505,Ausgabenansätze in der Mittelfristigen Finanzplanung,minor,2017-09-27,Baden-Württemberg,SPD,Peter Hofelich,Ministerium für Finanzen
2608,https://kleineanfragen.de/baden-wuerttemberg/16/2524-stadtbahn-baden-baden-wahlkreis-33,16,2524,Stadtbahn Baden-Baden (Wahlkreis 33),minor,2017-09-26,Baden-Württemberg,CDU,Tobias Wald,"Ministerium für Wirtschaft, Arbeit und Wohnungsbau;Ministerium für Verkehr"
2609,https://kleineanfragen.de/baden-wuerttemberg/16/2504-breitbandversorgung-im-landkreis-freudenstadt,16,2504,Breitbandversorgung im Landkreis Freudenstadt,minor,2017-09-26,Baden-Württemberg,FDP/DVP,Timm Kern,"Ministerium für Inneres, Digitalisierung und Migration"
2610,https://kleineanfragen.de/baden-wuerttemberg/16/2354-pflegesituation-und-situation-der-pflegeeinrichtungen-im-wahlkreis-karlsruhe-stadt,16,2354,Pflegesituation und Situation der Pflegeeinrichtungen im Wahlkreis Karlsruhe-Stadt,minor,2017-09-26,Baden-Württemberg,CDU,Christine Neumann,"Ministerium für Arbeit und Sozialordnung, Familie, Frauen und Senioren;Ministerium für Soziales und Integration"
2611,https://kleineanfragen.de/baden-wuerttemberg/16/2250-pruefungsaufgaben-an-berufsschulen-im-fach-gemeinschaftskunde-mit-bezug-zur-partei-afd-vor-dem-hintergrund-der,16,2250,Prüfungsaufgaben an Berufsschulen im Fach Gemeinschaftskunde mit Bezug zur Partei AfD vor dem Hintergrund der Entscheidung des Bundesverfassungsgericht 2 BvE 2/14 und frühere Prüfungsaufgaben mit Parteibezug,major,2017-09-26,Baden-Württemberg,AfD,,Landesregierung
2612,https://kleineanfragen.de/baden-wuerttemberg/16/2527-meldeverfahren-bei-fund-von-auerwild-nachweisen,16,2527,Meldeverfahren bei Fund von Auerwild-Nachweisen,minor,2017-09-25,Baden-Württemberg,FDP/DVP,Andreas Glück,"Ministerium für Umwelt, Klima und Energiewirtschaft"
2613,https://kleineanfragen.de/baden-wuerttemberg/16/2447-chancen-zur-reaktivierung-der-voralbbahn-boller-baehnle,16,2447,Chancen zur Reaktivierung der Voralbbahn (Boller Bähnle),minor,2017-09-25,Baden-Württemberg,SPD,Andreas Kenner;Sascha Binder;Peter Hofelich,Ministerium für Verkehr
2614,https://kleineanfragen.de/baden-wuerttemberg/16/2548-nachverteilungsverfahren-des-krankenhausstrukturfonds,16,2548,Nachverteilungsverfahren des Krankenhausstrukturfonds,minor,2017-09-22,Baden-Württemberg,SPD,Rainer Hinderer,"Ministerium für Arbeit und Sozialordnung, Familie, Frauen und Senioren;Ministerium für Soziales und Integration"
2615,https://kleineanfragen.de/baden-wuerttemberg/16/2521-breitbandversorgung-im-landkreis-konstanz,16,2521,Breitbandversorgung im Landkreis Konstanz,minor,2017-09-22,Baden-Württemberg,FDP/DVP,Jürgen Keck,"Ministerium für Inneres, Digitalisierung und Migration"
2616,https://kleineanfragen.de/baden-wuerttemberg/16/2433-ausbau-des-informatikunterrichts-in-baden-wuerttemberg,16,2433,Ausbau des Informatikunterrichts in Baden-Württemberg,minor,2017-09-22,Baden-Württemberg,Die Grünen,Alexander Salomon,"Ministerium für Wissenschaft, Forschung und Kunst;Ministerium für Kultus, Jugend und Sport"
2617,https://kleineanfragen.de/baden-wuerttemberg/16/2514-bau-der-b-28-tuebingen-rottenburg,16,2514,Bau der B 28 Tübingen–Rottenburg,minor,2017-09-21,Baden-Württemberg,SPD,Martin Rivoir,Ministerium für Verkehr
2618,https://kleineanfragen.de/baden-wuerttemberg/16/2442-angriff-auf-einen-sogenannten-antifaschisten-unter-beleuchtung-und-besonderer-betrachtung-des-konfliktfelds-linker,16,2442,Angriff auf einen sogenannten „Antifaschisten“ unter Beleuchtung und besonderer Betrachtung des Konfliktfelds linker Strukturen,major,2017-09-21,Baden-Württemberg,AfD,,Landesregierung
2619,https://kleineanfragen.de/baden-wuerttemberg/16/2349-umsetzung-von-anti-terror-massnahmen-in-baden-wuerttemberg,16,2349,Umsetzung von Anti-Terror-Maßnahmen in Baden-Württemberg,major,2017-09-21,Baden-Württemberg,SPD,,Landesregierung
2620,https://kleineanfragen.de/baden-wuerttemberg/16/2153-hilfe-zur-selbsthilfe-rahmenbedingungen-fuer-ein-selbstbestimmtes-und-zukunftssicherndes-risikomanagement-in-der,16,2153,Hilfe zur Selbsthilfe – Rahmenbedingungen für ein selbstbestimmtes und zukunftssicherndes Risikomanagement in der Land- und Forstwirtschaft,major,2017-09-21,Baden-Württemberg,FDP/DVP,,Landesregierung
2621,https://kleineanfragen.de/baden-wuerttemberg/16/2539-steuerehrlichkeit-linksautonomer-zentren,16,2539,Steuerehrlichkeit linksautonomer Zentren,minor,2017-09-20,Baden-Württemberg,AfD,Daniel Rottmann,"Ministerium für Inneres, Digitalisierung und Migration;Ministerium für Finanzen"
2622,https://kleineanfragen.de/baden-wuerttemberg/16/2512-fahrzeuge-auf-der-donau-iller-s-bahn,16,2512,Fahrzeuge auf der Donau-Iller-S-Bahn,minor,2017-09-20,Baden-Württemberg,SPD,Martin Rivoir,Ministerium für Verkehr
2623,https://kleineanfragen.de/baden-wuerttemberg/16/2506-verteilung-der-fuer-die-schulbausanierung-vorgesehenen-bundesmittel,16,2506,Verteilung der für die Schulbausanierung vorgesehenen Bundesmittel,minor,2017-09-20,Baden-Württemberg,SPD,Peter Hofelich,"Ministerium für Kultus, Jugend und Sport;Ministerium für Inneres, Digitalisierung und Migration;Ministerium für Finanzen"
2624,https://kleineanfragen.de/baden-wuerttemberg/16/2499-bau-und-brandschutzmassnahmen-im-polizeipraesidium-mannheim,16,2499,Bau- und Brandschutzmaßnahmen im Polizeipräsidium Mannheim,minor,2017-09-20,Baden-Württemberg,SPD,Boris Weirauch,Ministerium für Finanzen
2625,https://kleineanfragen.de/baden-wuerttemberg/16/2498-diskriminierung-beim-online-karrierenetzwerk-x,16,2498,Diskriminierung beim Online-Karrierenetzwerk X.,minor,2017-09-20,Baden-Württemberg,SPD,Daniel Born,"Ministerium für Arbeit und Sozialordnung, Familie, Frauen und Senioren;Ministerium für Soziales und Integration"
2626,https://kleineanfragen.de/baden-wuerttemberg/16/2455-oeffentliche-aussagen-des-ministers-fuer-laendlichen-raum-und-verbraucherschutz-zur-kuenftigen-gestaltung-des,16,2455,Öffentliche Aussagen des Ministers für Ländlichen Raum und Verbraucherschutz zur künftigen Gestaltung des Jagdrechts,minor,2017-09-20,Baden-Württemberg,FDP/DVP,Dr. Friedrich Bullinger,Ministerium für Ländlichen Raum und Verbraucherschutz
2627,https://kleineanfragen.de/baden-wuerttemberg/16/2491-projekte-von-bodenseekonferenz-und-kooperationsfonds-oberrhein,16,2491,Projekte von Bodenseekonferenz und Kooperationsfonds Oberrhein,minor,2017-09-19,Baden-Württemberg,AfD,Klaus Dürr,"Ministerium für Inneres, Digitalisierung und Migration"
2628,https://kleineanfragen.de/baden-wuerttemberg/16/2468-leistungen-fuer-abschiebehaeftlinge-im-einzelplan-03-des-landeshaushalts-2017,16,2468,Leistungen für Abschiebehäftlinge im Einzelplan 03 des Landeshaushalts 2017,minor,2017-09-19,Baden-Württemberg,AfD,Klaus Dürr,"Ministerium für Inneres, Digitalisierung und Migration"
2629,https://kleineanfragen.de/baden-wuerttemberg/16/2467-abschiebehafteinrichtung,16,2467,Abschiebehafteinrichtung,minor,2017-09-19,Baden-Württemberg,AfD,Klaus Dürr,"Ministerium für Inneres, Digitalisierung und Migration"
2630,https://kleineanfragen.de/baden-wuerttemberg/16/2465-einnahmen-und-ausgaben-der-zentralen-bussgeldstelle,16,2465,Einnahmen und Ausgaben der Zentralen Bußgeldstelle,minor,2017-09-19,Baden-Württemberg,AfD,Klaus Dürr,"Ministerium für Inneres, Digitalisierung und Migration"
2631,https://kleineanfragen.de/baden-wuerttemberg/16/2464-kosten-fuer-die-kampfmittelbeseitigung-in-baden-wuerttemberg,16,2464,Kosten für die Kampfmittelbeseitigung in Baden-Württemberg,minor,2017-09-19,Baden-Württemberg,AfD,Klaus Dürr,"Ministerium für Inneres, Digitalisierung und Migration"
2632,https://kleineanfragen.de/baden-wuerttemberg/16/2490-wesen-und-kosten-der-apothekenvisitatoren,16,2490,Wesen und Kosten der „Apothekenvisitatoren“,minor,2017-09-15,Baden-Württemberg,AfD,Klaus Dürr,"Ministerium für Inneres, Digitalisierung und Migration"
2633,https://kleineanfragen.de/baden-wuerttemberg/16/2472-sonderkontingent-fluechtlinge-im-haushaltsplan-2017,16,2472,Sonderkontingent „Flüchtlinge“ im Haushaltsplan 2017,minor,2017-09-15,Baden-Württemberg,AfD,Klaus Dürr,"Ministerium für Inneres, Digitalisierung und Migration"
2634,https://kleineanfragen.de/baden-wuerttemberg/16/2462-musikfestival-in-horb-am-neckar-vom-3-bis-5-august-2017,16,2462,Musikfestival in Horb am Neckar vom 3. bis 5. August 2017,minor,2017-09-13,Baden-Württemberg,AfD,Klaus Dürr,"Ministerium für Inneres, Digitalisierung und Migration"
2635,https://kleineanfragen.de/baden-wuerttemberg/16/2471-ausgaben-fuer-beratung-in-den-erstaufnahmeeinrichtungen-im-landeshaushalt-2017,16,2471,Ausgaben für Beratung in den Erstaufnahmeeinrichtungen im Landeshaushalt 2017,minor,2017-09-11,Baden-Württemberg,AfD,Klaus Dürr,"Ministerium für Inneres, Digitalisierung und Migration"
2636,https://kleineanfragen.de/baden-wuerttemberg/16/2466-positionen-im-einzelplan-03-des-landeshaushalts-2017-sind-mittel-zur-folterverhuetung-in-deutschland-noetig,16,2466,Positionen im Einzelplan 03 des Landeshaushalts 2017 – Sind Mittel zur Folterverhütung in Deutschland nötig?,minor,2017-09-11,Baden-Württemberg,AfD,Klaus Dürr,Ministerium der Justiz und für Europa
2637,https://kleineanfragen.de/baden-wuerttemberg/16/2463-verwaltungskosten-dokumentationszentrum-u-a-positionen-im-einzelplan-03-des-landeshaushalts-2017,16,2463,"Verwaltungskosten, Dokumentationszentrum u. a. Positionen im Einzelplan 03 des Landeshaushalts 2017",minor,2017-09-11,Baden-Württemberg,AfD,Klaus Dürr,"Ministerium für Inneres, Digitalisierung und Migration"
2638,https://kleineanfragen.de/baden-wuerttemberg/16/2475-was-plant-die-landesregierung-zukuenftig-mit-der-derzeitigen-landesakademie-fuer-lehrerfortbildung-auf-der-comburg,16,2475,Was plant die Landesregierung zukünftig mit der derzeitigen Landesakademie für Lehrerfortbildung auf der Comburg (Schwäbisch Hall)?,minor,2017-09-08,Baden-Württemberg,FDP/DVP,Dr. Friedrich Bullinger,"Ministerium für Verkehr;Ministerium für Finanzen;Ministerium für Kultus, Jugend und Sport"
2639,https://kleineanfragen.de/baden-wuerttemberg/16/2473-veranschlagungen-im-einzelplan-05-fuer-die-landesvertretung-bruessel-und-den-beobachter-der-laender-in-der-eu,16,2473,Veranschlagungen im Einzelplan 05 für die Landesvertretung Brüssel und den Beobachter der Länder in der EU,minor,2017-09-07,Baden-Württemberg,AfD,Klaus Dürr,Ministerium der Justiz und für Europa
2640,https://kleineanfragen.de/baden-wuerttemberg/16/2476-kommunikation-zwischen-dem-ministerium-fuer-laendlichen-raum-und-verbraucherschutz-und-dem-wuerttembergischen,16,2476,Kommunikation zwischen dem Ministerium für Ländlichen Raum und Verbraucherschutz und dem Württembergischen Anglerverein e. V.,minor,2017-09-06,Baden-Württemberg,FDP/DVP,Klaus Hoher;Dr. Friedrich Bullinger,Ministerium für Ländlichen Raum und Verbraucherschutz
2641,https://kleineanfragen.de/baden-wuerttemberg/16/2474-ausgaben-des-staatsministeriums-in-den-kapiteln-0201-und-0202,16,2474,Ausgaben des Staatsministeriums in den Kapiteln 0201 und 0202,minor,2017-09-06,Baden-Württemberg,AfD,Rainer Podeswa,Staatsministerium
2642,https://kleineanfragen.de/baden-wuerttemberg/16/2461-toetungsdelikt-in-horb-am-neckar-am-13-juli-2017,16,2461,Tötungsdelikt in Horb am Neckar am 13. Juli 2017,minor,2017-09-06,Baden-Württemberg,AfD,Klaus Dürr,"Ministerium der Justiz und für Europa;Ministerium für Inneres, Digitalisierung und Migration"
2643,https://kleineanfragen.de/baden-wuerttemberg/16/2450-phosphoreintraege-in-baden-wuerttembergische-gewaesser,16,2450,Phosphoreinträge in baden-württembergische Gewässer,minor,2017-09-05,Baden-Württemberg,SPD,Gabi Rolland,"Ministerium für Ländlichen Raum und Verbraucherschutz;Ministerium für Umwelt, Klima und Energiewirtschaft"
2644,https://kleineanfragen.de/baden-wuerttemberg/16/2445-anzeigen-in-der-presse-durch-die-landesregierung-2016-sowie-in-vergangenen-zeitraeumen,16,2445,Anzeigen in der Presse durch die Landesregierung 2016 sowie in vergangenen Zeiträumen,minor,2017-09-05,Baden-Württemberg,AfD,Klaus Dürr;Lars Patrick Berg,"Ministerium für Inneres, Digitalisierung und Migration"
2645,https://kleineanfragen.de/baden-wuerttemberg/16/2435-sicherheitslage-in-den-staatlichen-museen-in-karlsruhe,16,2435,Sicherheitslage in den Staatlichen Museen in Karlsruhe,minor,2017-09-05,Baden-Württemberg,SPD,Stefan Fulst-Blei,"Ministerium für Wissenschaft, Forschung und Kunst"
2646,https://kleineanfragen.de/baden-wuerttemberg/16/2449-ueberlastungsanzeigen-in-der-pflege-an-der-universitaetsklinik-freiburg,16,2449,Überlastungsanzeigen in der Pflege an der Universitätsklinik Freiburg,minor,2017-09-04,Baden-Württemberg,CDU,Patrick Rapp,"Ministerium für Wissenschaft, Forschung und Kunst"
2647,https://kleineanfragen.de/baden-wuerttemberg/16/2441-unterbringung-von-asylbewerbern-in-gaildorf,16,2441,Unterbringung von Asylbewerbern in Gaildorf,minor,2017-09-04,Baden-Württemberg,AfD,Udo Stein,"Ministerium für Inneres, Digitalisierung und Migration"
2648,https://kleineanfragen.de/baden-wuerttemberg/16/2440-polizisten-aus-baden-wuerttemberg-beim-g20-gipfel-in-hamburg-kosten-und-unterbringung,16,2440,Polizisten aus Baden-Württemberg beim G20-Gipfel in Hamburg − Kosten und Unterbringung,minor,2017-09-04,Baden-Württemberg,AfD,Udo Stein,"Ministerium für Inneres, Digitalisierung und Migration"
2649,https://kleineanfragen.de/baden-wuerttemberg/16/2434-verkehrserziehung-an-grund-und-hauptschulen-im-rems-murr-kreis,16,2434,Verkehrserziehung an Grund- und Hauptschulen im Rems-Murr-Kreis,minor,2017-09-01,Baden-Württemberg,SPD,Gernot Gruber,"Ministerium für Inneres, Digitalisierung und Migration"
2650,https://kleineanfragen.de/baden-wuerttemberg/16/2460-mittelvergabe-im-einzelplan-06-ministerium-fuer-finanzen-des-staatshaushaltsplans,16,2460,Mittelvergabe im Einzelplan 06 – Ministerium für Finanzen – des Staatshaushaltsplans,minor,2017-08-31,Baden-Württemberg,AfD,Emil Sänze,Ministerium für Finanzen
2651,https://kleineanfragen.de/baden-wuerttemberg/16/2429-verkehrserziehung-in-mannheim,16,2429,Verkehrserziehung in Mannheim,minor,2017-08-30,Baden-Württemberg,SPD,Stefan Fulst-Blei;Boris Weirauch,"Ministerium für Inneres, Digitalisierung und Migration"
2652,https://kleineanfragen.de/baden-wuerttemberg/16/2424-koordination-und-planung-von-baumassnahmen,16,2424,Koordination und Planung von Baumaßnahmen,minor,2017-08-30,Baden-Württemberg,FDP/DVP,Timm Kern,Ministerium für Verkehr
2653,https://kleineanfragen.de/baden-wuerttemberg/16/2251-koerperliche-und-haeusliche-gewalt,16,2251,Körperliche und häusliche Gewalt,minor,2017-08-30,Baden-Württemberg,CDU,Christine Neumann,"Ministerium für Arbeit und Sozialordnung, Familie, Frauen und Senioren;Ministerium der Justiz und für Europa;Ministerium für Inneres, Digitalisierung und Migration;Ministerium für Soziales und Integration"
2654,https://kleineanfragen.de/baden-wuerttemberg/16/2395-verkehrserziehung-im-landkreis-loerrach,16,2395,Verkehrserziehung im Landkreis Lörrach,minor,2017-08-28,Baden-Württemberg,SPD,Rainer Stickelberger,"Ministerium für Inneres, Digitalisierung und Migration"
2655,https://kleineanfragen.de/baden-wuerttemberg/16/2394-verkehrserziehung-im-landkreis-reutlingen,16,2394,Verkehrserziehung im Landkreis Reutlingen,minor,2017-08-24,Baden-Württemberg,SPD,Nils Schmid,"Ministerium für Inneres, Digitalisierung und Migration"
